NO_APLICA,NO_APLICA,1,Matutino,0,0,No aplica,,,,NO APLICA,0,NO APLICA,0,NO APLICA,NO APLICA
11ETV0629Z,TELESECUNDARIA NUM. 678,1,Matutino,539,6,Completa,0,0,0,LAS FLORES,22,LAS FLORES,13,Doctor Mora,ARMANDO ARANDA JARAMILLO
11KJN0053A,PREESCOLAR COMUNITARIO,2,Vespertino,3,88,No aplica,0,0,0,LAS FLORES,22,LAS FLORES,13,Doctor Mora,PENDIENTE
11KJN0584P,PREESCOLAR COMUNITARIO,1,Matutino,3,88,Incompleta,1,0,1,LA VACIADA,230,LA VACIADA,33,San Luis de la Paz,NABOR ROGELIO RIVERA GALINDO
11KPR3989R,CURSO COMUNITARIO,1,Matutino,3,88,No aplica,0,0,0,EL HARTON,19,EL HARTON,40,Tierra Blanca,PENDIENTE
11EJN0428N,JARDIN DE NIÑOS,1,Matutino,510,2,No aplica,0,0,0,BENITO JUAREZ S/N,35,EL PICACHO,40,Tierra Blanca,MA. GUADALUPE MATA
11KJN0298V,PREESCOLAR COMUNITARIO,1,Matutino,3,88,No aplica,0,0,0,XOCONOXTLE,51,XOCONOXTLE,40,Tierra Blanca,PENDIENTE
11ETV0615X,"TELESECUNDARIA NUM. 614 ""JORGE IBARGÜENGOITIA""",1,Matutino,549,6,Incompleta,1,1,0,"CALLE EL APARTADERO NÚMERO EXTERIOR: SN,POBLADO COMUNAL EL APARTADERO, CÓDIGO POSTAL 37977, ENTRE CALLE NINGUNO, Y CALLE NINGUNO, POSTERIOR CALLE NINGUNO",53,EL APARTADERO,40,Tierra Blanca,MARIA GUADALUPE GALLEGOS Y GARCIA
11KPR0532Z,CURSO COMUNITARIO,1,Matutino,3,88,Incompleta,1,0,1,"CALLE TEMASCALES NÚMERO EXTERIOR: SN, RANCHO O RANCHERIA TEMASCALES, CÓDIGO POSTAL 37978, ENTRE CALLE NINGUNO, Y CALLE NINGUNO, POSTERIOR CALLE NINGUNO",62,TEMASCALES,40,Tierra Blanca,MARTHA GUADALUPE BREÑA BRIONES
11KJN0357U,PREESCOLAR COMUNITARIO,1,Matutino,3,88,No aplica,0,0,0,DERRAMADERO DE ENMEDIO,78,DERRAMADERO DE EN MEDIO,13,Doctor Mora,PENDIENTE
11ETK0090D,TELEBACHILLERATO COMUNITARIO SAN LUIS DE LA PAZ-SAN JUAN DE LOS RANGELES,2,Vespertino,888,88,No aplica,0,0,0,"CALLE BUENAVISTA (EL CUERNITO) NÚMERO EXTERIOR: SN, RANCHO O RANCHERIA BUENAVISTA (EL CUERNITO), CÓDIGO POSTAL 37913, ENTRE CALLE NINGUNO, Y CALLE NINGUNO, POSTERIOR CALLE NINGUNO",15,BUENAVISTA (EL CUERNITO),33,San Luis de la Paz,ANGEL MAURICIO MOKARZEL ALBA
11BBE0132P,BIBLIOTECA DR. PEDRO LOPEZ RIOS DE LA ESCUELA DE NIVEL MEDIO SUPERIOR DE SAN LUIS DE LA PAZ U.G.,1,Matutino,888,88,No aplica,0,0,0,"CALLE ALLENDE NÚMERO EXTERIOR: 852 , COLONIA LA CENTRAL, CÓDIGO POSTAL 37906, ENTRE CALLE MÉXICO 68, Y CALLE DOCTOR MORA, POSTERIOR CALLE VELAZCO IBARRA",1,SAN LUIS DE LA PAZ,33,San Luis de la Paz,MARIA DOLORES GARCIA LA SIENRA CAMARERO
11AIZ0118C,SUPERVISION DE ZONA ESCOLAR NUM. 118 (PRIMARIA),4,Discontinuo,118,18,No aplica,0,0,0,"BOULEVARD SIERRA GORDA NÚMERO EXTERIOR: 116 , COLONIA LINDAVISTA, CÓDIGO POSTAL 37907, ENTRE PRIVADA DE HIDALGO, Y CALLE CAMARGO, POSTERIOR CALLE SANTOS DEGOLLADO",1,SAN LUIS DE LA PAZ,33,San Luis de la Paz,MA. VALENTINA HIDALGO GUTIERREZ
11DPR0287W,MORELOS,1,Matutino,57,18,Incompleta,1,0,0,"CALLE COVADONGA NÚMERO EXTERIOR: SN, RANCHO O RANCHERIA COVADONGA, CÓDIGO POSTAL 37914, ENTRE CALLE NINGUNO, Y CALLE NINGUNO, POSTERIOR CALLE NINGUNO",37,COVADONGA,33,San Luis de la Paz,PATRICIA MENDEZ MOYA
11DPR3484R,IGNACIO ZARAGOZA,2,Vespertino,109,21,No aplica,0,0,0,SANTA ANITA,95,SANTA ANITA,32,San José Iturbide,HERNAN HERNANDEZ NAVARRETE
11DJN4617H,JARDIN DE NIÑOS CENTENARIO DEL EJERCITO MEXICANO,1,Matutino,243,1,Incompleta,1,0,1,RANCHO LA SEMITA NUM. SN,216,LA SEMITA,33,San Luis de la Paz,MARIA EUGENIA SANCHEZ ORDUÑA
11KPR3965H,CURSO COMUNITARIO,1,Matutino,3,88,No aplica,0,0,0,LA TERESA,223,LA TERESA,33,San Luis de la Paz,JUAN LUIS PUGA RAMIREZ
11BBI0125B,BIBLIOTECA PUBLICA MUNICIPIAL DHI NEGUI PODI NUM. 4701,2,Vespertino,888,88,No aplica,0,0,0,SAN ILDEFONSO NUM. 55,10,CIENEGUILLA,40,Tierra Blanca,CELIA RAMIREZ GARCIA
11EJN1137E,JARDIN DE NIÑOS,1,Matutino,302,1,No aplica,0,0,0,LA ALDEA,92,LA ALDEA,13,Doctor Mora,LESLIE CARMEN GARCIA FUENTES
11DJN4011T,PROMOTOR TECNICO,1,Matutino,243,1,No aplica,0,0,0,(DESCONOCIDO 11DJN4011T) S/N,13,EL BOZO,33,San Luis de la Paz,PENDIENTE
11DJN4133D,JARDIN DE NIÑOS,1,Matutino,68,7,No aplica,0,0,0,EL BOZO,13,EL BOZO,33,San Luis de la Paz,PENDIENTE
11DJN3691I,FRAY BERNARDINO ALVAREZ,1,Matutino,242,1,Incompleta,1,0,1,LA CONCEPCION,33,LA CONCEPCION (LA CONCHA),33,San Luis de la Paz,ANGELICA MARIA GALINDO MELENDEZ
11DPR3881Q,BICENTENARIO DE LA INDEPENDENCIA,1,Matutino,118,18,No aplica,0,0,0,LA ONZA ADELANTE DE SAN ISIDRO RUMBO A LOS TOROS,299,LA ONZA,33,San Luis de la Paz,MONICA YAZMIN PARRA GUTIERREZ
11EJN1242P,OVIDIO DECROLY,1,Matutino,531,2,No aplica,0,0,0,"CALLE LA TAPONA NÚMERO EXTERIOR: SN, RANCHO O RANCHERIA LA TAPONA, CÓDIGO POSTAL 37947, ENTRE CALLE NINGUNO, Y CALLE NINGUNO, POSTERIOR CALLE NINGUNO",21,LA TAPONA,6,Atarjea,LUCERO PAOLA GALVAN LANDAVERDE
11BBI0031N,BIBLIOTECA PUBLICA MUNICIPAL AGUSTIN GONZALEZ DE COSSIO,2,Vespertino,888,88,No aplica,0,0,0,"AVENIDA GUANAJUATO NÚMERO EXTERIOR: 8 , COLONIA CIUDAD DR. MORA CENTRO, CÓDIGO POSTAL 37960, ENTRE CALLE JERECUARO, Y CALLE PLAZA PRINCIPAL, POSTERIOR CALLE ADOLFO LÓPEZ MATEOS",1,DOCTOR MORA,13,Doctor Mora,MARIA R. RAMIREZ ORTEGA
11KJN1562K,PREESCOLAR COMUNITARIO,1,Matutino,3,88,Incompleta,1,0,1,"CALLE ARROYO DE LA PLATA SAN MIGUEL NÚMERO EXTERIOR: SN, RANCHO O RANCHERIA ARROYO DE LA PLATA (SAN MIGUEL), CÓDIGO POSTAL 37965, ENTRE CALLE NINGUNO, Y CALLE NINGUNO, POSTERIOR CALLE NINGUNO",3,ARROYO DE LA PLATA (SAN MIGUEL),13,Doctor Mora,MARTHA GUADALUPE BREÑA BRIONES
11FUA0137Z,UNIDAD DE SERVICIOS DE APOYO A LA EDUCACION REGULAR,1,Matutino,13,88,No aplica,0,0,0,"CALLE PINO SUÁREZ NÚMERO EXTERIOR: SN, RANCHERIA LOMA DE BUENAVISTA, CÓDIGO POSTAL 37965, ENTRE CALLE JERECUARO, Y CALLE OCAMPO, POSTERIOR CALLE NINGUNO",26,LOMA DE BUENAVISTA,13,Doctor Mora,VICTOR RAYMUNDO CELAYA RAMIREZ
11EJN0006F,GABRIELA MISTRAL,1,Matutino,506,2,Completa,0,0,0,"CALLE CALVARIO NÚMERO EXTERIOR: SN, PUEBLO CIUDAD VICTORIA, CÓDIGO POSTAL 37920, ENTRE CALLE 16 DE SEPTIEMBRE, Y CALLE LIBERTAD, POSTERIOR CALLE SAN JUAN",1,VICTORIA,43,Victoria,DOMITILA VARGAS GONZALEZ
11EJN0320W,"""ROSAURA ZAPATA """,1,Matutino,531,2,Incompleta,1,1,0,LAS FLORES,22,LAS FLORES,13,Doctor Mora,LAURA VERONICA ONTIVEROS HERNANDEZ
11EJN0703B,BENITO JUAREZ,1,Matutino,302,1,No aplica,0,0,0,PEÑA RODADA,39,PEÑA RODADA,13,Doctor Mora,MARIA LEONOR REGALADO ESTRADA
11DJN2558V,MIGUEL HIDALGO Y COSTILLA,1,Matutino,47,7,Completa,0,0,0,TULILLO DE ABAJO,108,TULILLO DE ABAJO,32,San José Iturbide,MARIA MUÑOZ MARTINEZ
11DPR1379T,IGNACIO ZARAGOZA,1,Matutino,147,18,Incompleta,1,1,0,MORELOS,52,LA ESCOBILLA,33,San Luis de la Paz,LUIS JOSE PICHARDO RODRIGUEZ
11DPR0291I,MANUEL M. PONCE,1,Matutino,147,18,Incompleta,1,0,1,GARIBALDI,67,GARIBALDI (EL CERRITO),33,San Luis de la Paz,SANDRA VERONICA YAÑEZ VELAZQUEZ
11KJN0349L,PREESCOLAR COMUNITARIO,1,Matutino,3,88,No aplica,0,0,0,MESA DE LA ESTACADA,102,MESA DE LA ESTACADA,33,San Luis de la Paz,PENDIENTE
11ETV0828Z,TELESECUNDARIA NUM. 828,1,Matutino,525,6,Completa,0,0,0,LAS TUZAS,110,LAS TUZAS,32,San José Iturbide,DAVID MURILLO CERVANTES
11DJN0112Q,SR.JESUS VIZCAYA SOTO,1,Matutino,47,7,Incompleta,1,1,0,PINOS NUM. 21 A MEDIA CUADRA DEL TEMPLO,112,LA VENTA,32,San José Iturbide,LUZ MARIA BARRON HERNANDEZ
11DJN2927Y,JARDIN DE NIÑOS,1,Matutino,241,1,Incompleta,1,0,1,LA LUZ,90,LA LUZ,33,San Luis de la Paz,MAYRA LILIANA TORRES GARCÍA
11DPR2931A,HIMNO NACIONAL,2,Vespertino,167,18,No aplica,0,0,0,"CALLE SAN MARTÍN NÚMERO EXTERIOR: SN, RANCHO O RANCHERIA SAN MARTIN, CÓDIGO POSTAL 37914, ENTRE CALLE NINGUNO, Y CALLE NINGUNO, POSTERIOR CALLE NINGUNO",333,SAN MARTIN,33,San Luis de la Paz,MARTIN GASPAR ARREDONDO JARAMILLO
11DPR2836X,EL NIGROMANTE,2,Vespertino,57,18,No aplica,0,0,0,SAN ANTONIO DE LOURDES,9005,"SAN ANTONIO DE LOURDES MPIO 029, LOC. 0184",33,San Luis de la Paz,JAQUELINE ORTEGA TORRES
11KJN0342S,PREESCOLAR COMUNITARIO,1,Matutino,3,88,No aplica,0,0,0,LOS JUAN DIEGOS,16,LOS JUAN DIEGOS,34,Santa Catarina,PENDIENTE
11ETV0842S,TELESECUNDARIA NUM. 842,1,Matutino,550,6,Completa,0,0,0,MILPILLAS DE SANTIAGO,45,MILPILLAS DE SANTIAGO,43,Victoria,JOHSUE NEPHTALLY MARTINEZ ROCHA
11KPR0272D,CURSO COMUNITARIO,1,Matutino,3,88,No aplica,0,0,0,LOMA DEL COPUDO,52,LOMA DEL COPUDO,34,Santa Catarina,ELIA MARTINEZ HERNANDEZ
11EJN0993I,INDEPENDENCIA,1,Matutino,301,1,Incompleta,1,0,1,"CALLE LAS ADJUNTAS NÚMERO EXTERIOR: SN,RANCHO O RANCHERIA LAS ADJUNTAS, CÓDIGO POSTAL 37976, ENTRE CALLE NINGUNO, Y CALLE NINGUNO, POSTERIOR CALLE NINGUNO",2,LAS ADJUNTAS,40,Tierra Blanca,NORMA ALICIA SALINAS SAENZ
11DJN2641U,JARDIN DE NIÑOS,1,Matutino,86,7,No aplica,0,0,0,XACALAZUCHITL,95,XACALAZUCHITL,43,Victoria,PENDIENTE
11KPR0388D,CURSO COMUNITARIO,1,Matutino,3,88,Incompleta,1,0,1,EL PLATANAL,42,EL PLATANAL,45,Xichú,MARTINA HERNANDEZ RUIZ
11DJN2645Q,JARDIN DE NIÑOS,1,Matutino,11,7,No aplica,0,0,0,RIO ABAJO,44,RIO ABAJO,45,Xichú,PENDIENTE
11DPR0641X,BELISARIO DOMINGUEZ,1,Matutino,118,18,Incompleta,1,0,1,LOMA DE SAN JUAN,9006,"LOMA DE SAN JUAN MPIO. 029, LOC. 0043",33,San Luis de la Paz,FRIDA PAULINA GONZALEZ SEGURA
11DPR2632C,EMILIANO ZAPATA,1,Matutino,158,27,Incompleta,1,0,1,EL COPUDO,8,EL COPUDO,34,Santa Catarina,JUAN DIEGO REYES CRUZ
11DML0054P,CENTRO DE ATENCION MULTIPLE NATALIE CARTER BARRAGA,1,Matutino,8,88,No aplica,0,0,0,"CALLE CAMINO A LA UNIDAD DEPORTIVA NÚMERO EXTERIOR: SN, RANCHO O RANCHERIA LLANO BLANCO, CÓDIGO POSTAL 37955, ENTRE CALLE NINGUNO, Y CALLE CORREGIDORA, POSTERIOR CALLE NINGUNO",19,LLANO BLANCO,34,Santa Catarina,ELIZABETH LOPEZ CUELLAR
11DPR3607K,MANUEL GUTIERREZ NAJERA,2,Vespertino,158,27,No aplica,0,0,0,RANCHO SAN JOSE DEL CHILAR,26,SAN JOSE DEL CHILAR,34,Santa Catarina,VELINA GUTIERREZ LOPEZ
11KJN0771J,PREESCOLAR COMUNITARIO,1,Matutino,3,88,Incompleta,1,0,1,"CALLE CALABAZAS NÚMERO EXTERIOR: SN, RANCHO O RANCHERIA GUADALUPE, CÓDIGO POSTAL 37932, ENTRE CALLE NINGUNO, Y CALLE NINGUNO, POSTERIOR CALLE NINGUNO",9,CALABAZAS,45,Xichú,SAUL SALAZAR BARBOSA
11KTV0075B,SECUNDARIA COMUNITARIA,1,Matutino,3,88,Incompleta,1,0,1,LABORCILLA,18,LABORCILLA,45,Xichú,DIEGO ALFREDO LOPEZ MORA
11ETV0976H,TELESECUNDARIA NUM. 976,1,Matutino,557,6,Incompleta,1,0,1,MESA DE CHALOC,25,MESA DE CHALOC,45,Xichú,BLANCA ALHELI HERNANDEZ ALVAREZ
11FIZ5062U,SUPERVISION DE ZONA ESCOLAR DE EDUCACION PRIMARIA NUM. 562,4,Discontinuo,562,2,No aplica,0,0,0,"BOULEVARD SIERRA GORDA NÚMERO EXTERIOR: 415 , COLONIA LA PALMA, CÓDIGO POSTAL 37906, ENTRE AVENIDA LIBRAMIENTO SUR, Y CALLE RODADA LA PALMA, POSTERIOR CALLE RÍO MOCTEZUMA",1,SAN LUIS DE LA PAZ,33,San Luis de la Paz,ROBERTO DURAN GRAJALES
11FEI0013R,MODULO DE ATENCION Y SERVICIOS,4,Discontinuo,888,88,No aplica,0,0,0,"BOULEVARD SIERRA GORDA NÚMERO EXTERIOR: 415 , COLONIA LA PALMA, CÓDIGO POSTAL 37906, ENTRE AVENIDA LIBRAMIENTO SUR, Y CALLE RODADA LA PALMA, POSTERIOR CALLE RÍO MOCTEZUMA",1,SAN LUIS DE LA PAZ,33,San Luis de la Paz,ALICIA ARELLANO VEGA
11ETK0010B,TELEBACHILLERATO COMUNITARIO DE VICTORIA,2,Vespertino,888,88,No aplica,0,0,0,RANCHO MALINTO (SAN JUAN MALINTO),37,MALINTO,43,Victoria,PENDIENTE
11EJN1018R,IGNACIO ALLENDE,1,Matutino,301,1,No aplica,0,0,0,"CALLE ADJUNTAS NÚMERO EXTERIOR: SN, RANCHO O RANCHERIA ADJUNTAS, CÓDIGO POSTAL 37933, ENTRE CALLE NINGUNO, Y CALLE NINGUNO, POSTERIOR CALLE NINGUNO",2,ADJUNTAS,45,Xichú,VIRGINIA DIAZ DIAZ
11ETV0940T,TELESECUNDARIA NUM. 940,1,Matutino,557,6,Incompleta,1,0,1,CALABAZAS,9,CALABAZAS,45,Xichú,NAZARET RESENDIZ RINCON
11ETH0210M,VIDEOBACHILLERATO,1,Matutino,,,No aplica,0,0,0,"CALLE CAMINO A CHARCO DE LUCAS NÚMERO EXTERIOR: SN, RANCHO O RANCHERIA EL GUAMUCHIL, CÓDIGO POSTAL 37935, ENTRE CALLE NINGUNO, Y CALLE NINGUNO, POSTERIOR CALLE NINGUNO",16,EL GUAMUCHIL,45,Xichú,DANIEL ZAMARRON PEREZ
11BBI0218R,BIBLIOTECA PUBLICA MUNICIPAL BICENTENARIO,4,Discontinuo,,,No aplica,0,0,0,"CALLE PLAZA DEL MAÍZ NÚMERO EXTERIOR: SN, RANCHO O RANCHERIA ATARJEA, CÓDIGO POSTAL 37940, ENTRE CALLE ARISTA, Y CALLE ZARAGOZA, POSTERIOR CALLE NINGUNO",1,ATARJEA,6,Atarjea,GUILLERMO ROSALES CAMACHO
11EMS0001C,EMSAD ATARJEA,1,Matutino,,,No aplica,0,0,0,"CALLE ÁLAMOS NÚMERO EXTERIOR: SN, RANCHO O RANCHERIA ALAMOS, CÓDIGO POSTAL 37946, ENTRE CALLE NINGUNO, Y CALLE NINGUNO, POSTERIOR CALLE NINGUNO",2,ALAMOS,6,Atarjea,ARTURO DAVILA MEDINA
11DPR0304W,BANDERA NACIONAL,1,Matutino,181,18,Completa,0,0,0,"CALLE EXHACIENDA DE SANTA ANA NÚMERO EXTERIOR: SN, RANCHO O RANCHERIA EX-HACIENDA DE SANTA ANA (SANTA ANA Y LOBOS), CÓDIGO POSTAL 37917, ENTRE CALLE NINGUNO, Y CALLE NINGUNO, POSTERIOR CALLE NINGUNO",209,EX-HACIENDA DE SANTA ANA (SANTA ANA Y LOBOS),33,San Luis de la Paz,JOSE COVARRUBIAS TIERRAFRIA
11DPR3424C,NICOLAS BRAVO,1,Matutino,181,18,Incompleta,1,0,0,LA PROVIDENCIA DEL SALITRE,462,LA PROVIDENCIA (LA PROVIDENCIA DEL SALITRE),33,San Luis de la Paz,SANDRA DANIELA HERNANDEZ SANCHEZ
11KJN0189O,PREESCOLAR COMUNITARIO,1,Matutino,3,88,No aplica,0,0,0,FRACCION DEL CANO,6,FRACCION DEL CANO,40,Tierra Blanca,VICENTA GALLEGOS YATA
11DEX0010O,OFICINA DE PREPARATORIA ABIERTA,4,Discontinuo,888,88,No aplica,0,0,0,ABASOLO NUM. 114,1,SAN LUIS DE LA PAZ,33,San Luis de la Paz,PENDIENTE
11PET0150X,INSTITUTO AMERICANO,4,Discontinuo,,,No aplica,0,0,0,"PROLONGACIÓN DEGOLLADO NÚMERO EXTERIOR: 648 , COLONIA SAN ISIDRO, CÓDIGO POSTAL 37907, ENTRE CALLE NUEVO SAN LUIS, Y BOULEVARD SAN ISIDRO, POSTERIOR CALLE LUIS CALDERO",1,SAN LUIS DE LA PAZ,33,San Luis de la Paz,FILADELFO DURAN GONZALEZ
11EJN0172D,PAULINA,1,Matutino,506,2,Incompleta,1,0,0,"CALLE DIAMANTE NÚMERO EXTERIOR: 102 , COLONIA LOS PINOS, CÓDIGO POSTAL 37907, ENTRE AVENIDA CARRETERA A SAN ISIDRO, Y CALLE CAMARGO, POSTERIOR CALLE NINGUNO",1,SAN LUIS DE LA PAZ,33,San Luis de la Paz,VANESSA AMADOR VILLEGAS
11FZP0011P,SUPERVISION DE ZONA ESCOLAR DE EDUCACION PREESCOLAR NUM. 11,4,Discontinuo,11,7,No aplica,0,0,0,"BOULEVARD SIERRA GORDA NÚMERO EXTERIOR: 415 , COLONIA LA PALMA, CÓDIGO POSTAL 37906, ENTRE AVENIDA LIBRAMIENTO SUR, Y CALLE RODADA LA PALMA, POSTERIOR CALLE RÍO MOCTEZUMA",1,SAN LUIS DE LA PAZ,33,San Luis de la Paz,ESPERANZA ORNELAS ARELLANO
11FIZ0167G,SUPERVISION DE ZONA ESCOLAR DE EDUCACION PRIMARIA NUM. 167,4,Discontinuo,167,18,No aplica,0,0,0,"BOULEVARD SIERRA GORDA NÚMERO EXTERIOR: 116 , COLONIA LINDAVISTA, CÓDIGO POSTAL 37907, ENTRE PRIVADA DE HIDALGO, Y CALLE CAMARGO, POSTERIOR CALLE SANTOS DEGOLLADO",1,SAN LUIS DE LA PAZ,33,San Luis de la Paz,ARMANDO CARDOSO ARRIETA
11KJN0541R,PREESCOLAR COMUNITARIO,1,Matutino,3,88,No aplica,0,0,0,SAUZ DE HIGUERAS,81,SAUZ DE HIGUERAS,43,Victoria,TERESA PEREZ SANTOS
11DJN3488X,FERNANDO MONTES DE OCA,1,Matutino,250,1,No aplica,0,0,0,CONTADERO,85,EL CONTADERO,45,Xichú,ELVIRA NIETO CASAS
11KJN0770K,PREESCOLAR COMUNITARIO,1,Matutino,3,88,No aplica,0,0,0,MAJADA,87,MAJADA ALTA,45,Xichú,LEOPOLDO GARCIA RUIZ
11EPR0795Z,ESCUELA PRIMARIA,1,Matutino,555,2,No aplica,0,0,0,MAJADAS,87,MAJADA ALTA,45,Xichú,PENDIENTE
11DPR3253Z,14 DE SEPTIEMBRE,1,Matutino,178,21,No aplica,0,0,0,PUERTO DEL OBISPO DE ABAJO,44,PUERTO DEL OBISPO DE ABAJO,13,Doctor Mora,ROGELIO VALENCIA MENDEZ
11EJN1053X,VICENTE GERRERO,1,Matutino,302,1,No aplica,0,0,0,PUERTO DEL OBISPO DE ABAJO,44,PUERTO DEL OBISPO DE ABAJO,13,Doctor Mora,MARIA LILIA CORONA ORDUÑA
11DJN1221D,FERNANDO MONTES DE OCA,1,Matutino,218,1,Incompleta,1,1,0,"CALLE TIERRA PRIETA NÚMERO EXTERIOR: SN,RANCHO O RANCHERIA TIERRA PRIETA, CÓDIGO POSTAL 37965, ENTRE CALLE NINGUNO, Y CALLE NINGUNO, POSTERIOR CALLE NINGUNO",60,TIERRA PRIETA,13,Doctor Mora,ERIKA VIVIAN PEREZ SANCHEZ
11DJN4581J,NIÑOS HEROES,1,Matutino,218,1,Incompleta,1,0,1,"CALLE EL CARMEN NÚMERO EXTERIOR: SN,POBLADO COMUNAL EL CARMEN, CÓDIGO POSTAL 37967, ENTRE CALLE NINGUNO, Y CALLE NINGUNO, POSTERIOR CALLE NINGUNO",94,EL CARMEN,13,Doctor Mora,MARIA SOFIA SOTELO BAZALDUA
11KPR0506B,CURSO COMUNITARIO,1,Matutino,3,88,No aplica,0,0,0,HUERTA DE SAN JUAN,281,LA HUERTA,33,San Luis de la Paz,ASALIA GARCIA PEREZ
11KJN0560F,PREESCOLAR COMUNITARIO,1,Matutino,3,88,Incompleta,1,0,1,LA ONZA,299,LA ONZA,33,San Luis de la Paz,DIEGO ALFREDO LOPEZ MORA
11KJN0346O,PREESCOLAR COMUNITARIO,1,Matutino,3,88,Incompleta,1,0,1,"CALLE RANCHO NUEVO DE LAS TROJES NÚMERO EXTERIOR: SN, RANCHO O RANCHERIA RANCHO NUEVO DE LAS TROJES, CÓDIGO POSTAL 37915, ENTRE CALLE NINGUNO, Y CALLE NINGUNO, POSTERIOR CALLE NINGUNO",317,RANCHO NUEVO DE LAS TROJES,33,San Luis de la Paz,MARTHA GUADALUPE BREÑA BRIONES
11ETV0917S,TELESECUNDARIA NUM. 917,1,Matutino,557,6,Incompleta,1,0,1,ORGANITOS NUM. NO APLICA NO APLICA,34,ORGANITOS,45,Xichú,LIZBETH PAULINA MARTINEZ HERNANDEZ
11EJN0426P,SOR JUANA INES DE LA CRUZ,1,Matutino,510,2,Incompleta,1,1,0,EL PICACHO,35,EL PICACHO,40,Tierra Blanca,MIRIAM ITZEL TAPIA BARRAGAN
11FIZ0033R,SUPERVISION DE ZONA ESCOLAR DE EDUCACION PRIMARIA NUM. 33,4,Discontinuo,33,27,No aplica,0,0,0,"CALLE HIDALGO NÚMERO EXTERIOR: 62 , PUEBLO CIUDAD VICTORIA, CÓDIGO POSTAL 37920, ENTRE CALLE NUEVA, Y CALLE 5 DE MAYO, POSTERIOR CALLE 16 DE SEPTIEMBRE",1,VICTORIA,43,Victoria,MA. SARA RESENDIZ MARTINEZ
11DJN4006H,ANA FREUD,1,Matutino,241,1,Incompleta,1,1,0,"CALLE LA CRUZ DE GUERRERO NÚMERO EXTERIOR: SN, RANCHO O RANCHERIA LA CRUZ DE GUERRERO, CÓDIGO POSTAL 37914, ENTRE CALLE NINGUNO, Y CALLE NINGUNO, POSTERIOR CALLE NINGUNO",263,LA CRUZ DE GUERRERO,33,San Luis de la Paz,VIVIANA CORONILLA JARAMILLO
11KJN0191C,PREESCOLAR COMUNITARIO,1,Matutino,3,88,No aplica,0,0,0,MONTE PRIETO,28,MONTE PRIETO,40,Tierra Blanca,PENDIENTE
11ETK0289M,TELEBACHILLERATO COMUNITARIO TIERRA BLANCA EL APARTADERO,2,Vespertino,888,88,No aplica,0,0,0,"CALLE EL APARTADERO NÚMERO EXTERIOR: SN,POBLADO COMUNAL EL APARTADERO, CÓDIGO POSTAL 37977, ENTRE CALLE NINGUNO, Y CALLE NINGUNO, POSTERIOR CALLE NINGUNO",53,EL APARTADERO,40,Tierra Blanca,MAURICIO MOKARZEL ALBA
11KJN0186R,PREESCOLAR COMUNITARIO,1,Matutino,3,88,No aplica,0,0,0,EL APARTADERO,53,EL APARTADERO,40,Tierra Blanca,PENDIENTE
11AZP0086K,SUPERVISION DE ZONA ESCOLAR NUM. 86 (PREESCOLAR),4,Discontinuo,86,7,No aplica,0,0,0,LIBERTAD S/N ESQUINA CON MORELOS,1,VICTORIA,43,Victoria,FELISA SANCHEZ CELEDON
11DPR3271P,BENITO JUAREZ,1,Matutino,168,18,Incompleta,1,0,1,"CALLE LA ESCONDIDA NÚMERO EXTERIOR: SN, RANCHO O RANCHERIA LA ESCONDIDA, CÓDIGO POSTAL 37918, ENTRE CALLE NINGUNO, Y CALLE NINGUNO, POSTERIOR CALLE NINGUNO",53,LA ESCONDIDA,33,San Luis de la Paz,ADRIANA ALEJANDRA AGUILAR GONZALEZ
11DPR0292H,MIGUEL HIDALGO,1,Matutino,57,18,Completa,0,0,0,ESTACION DE LOURDES,85,LOURDES (ESTACION DE LOURDES),33,San Luis de la Paz,BENJAMIN MORENO CALDERON
11KJN0478F,PREESCOLAR COMUNITARIO,1,Matutino,3,88,Incompleta,1,0,1,"CALLE SAN ANTÓN NÚMERO EXTERIOR: SN, RANCHERIA SAN ANTON, CÓDIGO POSTAL 37945, ENTRE CALLE NINGUNO, Y CALLE NINGUNO, POSTERIOR CALLE NINGUNO",19,SAN ANTON,6,Atarjea,PENDIENTE
11ETV0920F,"TELESECUNDARIA NUM. 920 ""GABRIEL GARCIA MARQUEZ""",1,Matutino,549,6,Completa,0,0,0,RANCHO LA TAPONA S/N,21,LA TAPONA,6,Atarjea,J. FABIAN CASAS LOPEZ
11FIZ0178M,SUPERVISION DE ZONA ESCOLAR DE EDUCACION PRIMARIA NUM. 178,4,Discontinuo,178,21,No aplica,0,0,0,"CALLE IRAPUATO NÚMERO EXTERIOR: 60 , COLONIA CIUDAD DR. MORA CENTRO, CÓDIGO POSTAL 37960, ENTRE CALLE ARMANDO VALENCIA, Y CALLE ROGELIO VALENCIA, POSTERIOR CALLE NINGUNO",1,DOCTOR MORA,13,Doctor Mora,OFELIA BAZALDUA LUGO
11DJN1220E,OCTAVIO PAZ,1,Matutino,218,1,Incompleta,1,0,1,NEGRITAS,33,NEGRITAS,13,Doctor Mora,MARIA DE LOURDES GALLEGOS FERNANDEZ
11EJN0943A,MIGUEL HIDALGO Y COSTILLA,1,Matutino,302,1,No aplica,0,0,0,LAS TUZAS,110,LAS TUZAS,32,San José Iturbide,ELVIA MARGARITA OLVERA OLVERA
11DJN2951Y,PROMOTOR BACHILLERATO,1,Matutino,218,1,No aplica,0,0,0,(DESCONOCIDO 11DJN2951Y) S/N,4,EL BAÑO,13,Doctor Mora,PENDIENTE
11KJN0051C,PREESCOLAR COMUNITARIO,1,Matutino,3,88,Incompleta,1,0,1,EL BAÑO,4,EL BAÑO,13,Doctor Mora,PENDIENTE
11DJN3712E,SOR JUANA INES DE LA CRUZ,1,Matutino,218,1,Incompleta,1,0,1,"CALLE LAS PALMITAS NÚMERO EXTERIOR: SN,RANCHO O RANCHERIA LAS PALMITAS, CÓDIGO POSTAL 37967, ENTRE CALLE NINGUNO, Y CALLE NINGUNO, POSTERIOR CALLE NINGUNO",38,LAS PALMITAS,13,Doctor Mora,GABRIELA SEPTHAI URIBE LUGO
11BBE0241W,BIBLIOTECA DE LA ESCUELA PRIMARIA DIEGO RIVERA,2,Vespertino,888,88,No aplica,0,0,0,RANCHO PEÑA RODADA,39,PEÑA RODADA,13,Doctor Mora,MELVIN GIOVANNI VELAZQUEZ RUIZ
11DJN3427J,JOSE VASCONCELOS,1,Matutino,218,1,Incompleta,1,1,0,"CALLE LA PRESA DEL GATO NÚMERO EXTERIOR: SN,RANCHO O RANCHERIA LA PRESA DEL GATO, CÓDIGO POSTAL 37965, ENTRE CALLE NINGUNO, Y CALLE NINGUNO, POSTERIOR CALLE NINGUNO",40,LA PRESA DEL GATO,13,Doctor Mora,MATILDE AVILES RESENDIZ
11BBE0251C,BIBLIOTECA DE LA SECUNDARIA TECNICA NUM. 23,1,Matutino,888,88,No aplica,0,0,0,CIENEGUILLA,10,CIENEGUILLA,40,Tierra Blanca,MARTHA PATRICIA HERNANDEZ CONTRERAS
11KJN0880Q,PREESCOLAR COMUNITARIO,1,Matutino,3,88,No aplica,0,0,0,EL HARTON,19,EL HARTON,40,Tierra Blanca,MARTHA GUADALUPE BREÑA BRIONES
11EPR0808M,SOLIDARIDAD,1,Matutino,538,2,Incompleta,1,0,0,EL PICACHO,35,EL PICACHO,40,Tierra Blanca,ANAIL SANCHEZ CARDENAS
11KJN0693W,PREESCOLAR COMUNITARIO,1,Matutino,3,88,No aplica,0,0,0,EL HUIZACHE,55,EL HUIZACHE,40,Tierra Blanca,MA. MAGDALENA GARCIA ENRIQUEZ
11KJN1504U,PREESCOLAR COMUNITARIO,1,Matutino,3,88,No aplica,0,0,0,RANCHO JESUS MARIA,85,JESUS MARIA,13,Doctor Mora,DIEGO ALFREDO LOPEZ MORA
11DPR1367O,LIC. ADOLFO LOPEZ MATEOS,1,Matutino,168,18,Incompleta,1,0,1,EL BOZO,13,EL BOZO,33,San Luis de la Paz,GONZALO ARVIZU LEDESMA
11ETV1026P,TELESECUNDARIA NUM. 1026,1,Matutino,527,6,Completa,0,0,0,"CALLE BUENAVISTA (EL CUERNITO) NÚMERO EXTERIOR: SN, RANCHO O RANCHERIA BUENAVISTA (EL CUERNITO), CÓDIGO POSTAL 37913, ENTRE CALLE NINGUNO, Y CALLE NINGUNO, POSTERIOR CALLE NINGUNO",15,BUENAVISTA (EL CUERNITO),33,San Luis de la Paz,MARIA GABRIELA VILLEGAS MARMOLEJO
11ETK0259S,TELEBACHILLERATO COMUNITARIO SAN LUIS DE LA PAZ LA CRUZ DE GUERRERO,2,Vespertino,888,88,No aplica,0,0,0,"CALLE LA CRUZ DE GUERRERO NÚMERO EXTERIOR: SN, RANCHO O RANCHERIA LA CRUZ DE GUERRERO, CÓDIGO POSTAL 37914, ENTRE CALLE NINGUNO, Y CALLE NINGUNO, POSTERIOR CALLE NINGUNO",263,LA CRUZ DE GUERRERO,33,San Luis de la Paz,MAURICIO MOKARZEL ALBA
11DPR3656T,SOR JUANA INES DE LA CRUZ,2,Vespertino,180,21,No aplica,0,0,0,TULILLO DE ARRIBA,109,TULILLO DE ARRIBA,32,San José Iturbide,OLIVA PICHARDO GUDIÑO
11KJN0251A,PREESCOLAR COMUNITARIO,1,Matutino,3,88,No aplica,0,0,0,CERRITO DE GARIBALDI,67,GARIBALDI (EL CERRITO),33,San Luis de la Paz,PENDIENTE
11DPR2081R,BENITO JUAREZ,1,Matutino,181,18,Completa,0,0,0,LUZ DE LA ESQUINA,86,LA LUZ DE LA ESQUINA,33,San Luis de la Paz,VENANCIO VILLEDA CRUZ
11FCQ0017Y,CENTRO DE EDUCACION COMUNITARIA CONAFE,1,Matutino,3,88,No aplica,0,0,0,MESA DE LA ESTACADA,102,MESA DE LA ESTACADA,33,San Luis de la Paz,DIEGO ALFREDO LOPEZ MORA
11DPR1177X,BENITO JUAREZ,1,Matutino,147,18,Incompleta,1,0,1,RANCHO NUEVO DE LAS TROJES S/N,317,RANCHO NUEVO DE LAS TROJES,33,San Luis de la Paz,JOSE RAMON ROJAS MONASTERIO
11FMB0013G,CENTRO DE DESARROLLO EDUCATIVO,4,Discontinuo,888,88,No aplica,0,0,0,AVENIDA HIDALGO NUM. 33 A UN COSTADO DE LA PRIM. GRAL. LAZARO CARDENAS,1,DOCTOR MORA,13,Doctor Mora,ROGELIO VALENCIA MENDEZ
11AIZ0039Q,SUPERVISION DE ZONA ESCOLAR NUM. 39 (PRIMARIA),4,Discontinuo,39,21,No aplica,0,0,0,HIDALGO NUM. 6,1,DOCTOR MORA,13,Doctor Mora,OCTAVIO AVILES MIRANDA
11ADG0163F,UNIDAD DE SERVICIOS DE APOYO A LA EDUCACION DOCTOR MORA,4,Discontinuo,,,No aplica,0,0,0,"CALLE JERECUARO NÚMERO EXTERIOR: 63 , COLONIA CIUDAD DR. MORA CENTRO, CÓDIGO POSTAL 37960, ENTRE CALLE OCAMPO, Y CALLE JERECUARO, POSTERIOR CALLE OCAMPO",1,DOCTOR MORA,13,Doctor Mora,JUANA MARIA TORRES CRUZ
11DPR2876Y,MELCHOR OCAMPO,1,Matutino,180,21,Incompleta,1,1,0,TEPOZANES,101,TEPOZANES,32,San José Iturbide,DULCE MARIA VILLEGAS PEÑA
11EJN1055V,JARDIN DE NIÑOS,1,Matutino,302,1,No aplica,0,0,0,LAS TINAJAS,105,LAS TINAJAS DEL ARENAL,32,San José Iturbide,JULIA MARTINEZ LOPEZ
11DJN2792Z,JUVENTINO ROSAS,1,Matutino,241,1,No aplica,0,0,0,MANZANARES,97,MANZANARES,33,San Luis de la Paz,ANA LETICIA NUÑEZ SANCHEZ
11DPR0637K,JOSE MARIA MORELOS Y PAVON,1,Matutino,168,18,No aplica,0,0,0,MILPILLAS,108,MILPILLAS,33,San Luis de la Paz,MARIA ELIAN LOPEZ ORGANITOS
11EJN0960R,ESTEFANIA CASTAÑEDA,1,Matutino,301,1,Incompleta,1,0,1,EL CHAPIN,12,EL CHAPIN,34,Santa Catarina,MA. BEDA CABRERA CABRERA
11KJN0625Z,PREESCOLAR COMUNITARIO,1,Matutino,3,88,No aplica,0,0,0,PUERTO DE BUENAVISTA,8,BUENAVISTA (PUERTO DE BUENAVISTA),45,Xichú,EDITH RESENDIZ GUEVARA
11ETH0072A,VIDEOBACHILLERATO,1,Matutino,,,No aplica,0,0,0,"CALLE EJIDO BEGOÑA NÚMERO EXTERIOR: SN, EJIDO EJIDO BEGOÑA, CÓDIGO POSTAL 37967, ENTRE CALLE NINGUNO, Y CALLE NINGUNO, POSTERIOR CALLE NINGUNO",7,EJIDO BEGOÑA,13,Doctor Mora,ELOINA MODESTA HUERTA RAMOS
11DJN1219P,GUADALUPE VICTORIA,1,Matutino,218,1,Incompleta,1,0,1,LA ESTANCIA,21,LA ESTANCIA (EL CERRITO),13,Doctor Mora,EMILIANO SOSA LUGO
11EPR0724E,ROSARIO CASTELLANOS,1,Matutino,562,2,Incompleta,1,1,0,LA ESTANCIA,21,LA ESTANCIA (EL CERRITO),13,Doctor Mora,ALMENDRA GUADALUPE CUEVAS FLORES
11BBE0243U,BIBLIOTECA DE LA ESCUELA PRIMARIA FRANCISCO I. MADERO,1,Matutino,888,88,No aplica,0,0,0,LAS FLORES,22,LAS FLORES,13,Doctor Mora,MIRNA XOCHITL RESENDIZ ARVIZU
11EJN0700E,JARDIN DE NIÑOS,2,Vespertino,302,1,No aplica,0,0,0,LAS FLORES,22,LAS FLORES,13,Doctor Mora,PENDIENTE
11DJN4586E,BENITO JUAREZ,1,Matutino,218,1,Incompleta,1,0,1,"CALLE PEÑA RODADA NÚMERO EXTERIOR: SN,RANCHO O RANCHERIA PEÑA RODADA, CÓDIGO POSTAL 37966, ENTRE CALLE NINGUNO, Y CALLE NINGUNO, POSTERIOR CALLE NINGUNO",39,PEÑA RODADA,13,Doctor Mora,ELIZABETH RESENDIZ ORDUÑA
11ETV0631O,TELESECUNDARIA NUM. 673,1,Matutino,539,6,Completa,0,0,0,"CALLE PEÑA RODADA NÚMERO EXTERIOR: SN, RANCHO O RANCHERIA PEÑA RODADA, CÓDIGO POSTAL 37966, ENTRE CALLE NINGUNO, Y CALLE NINGUNO, POSTERIOR CALLE NINGUNO",39,PEÑA RODADA,13,Doctor Mora,MARIA DEL CARMEN LEAL JIMENEZ
11ETV0835I,TELESECUNDARIA NUM. 835,1,Matutino,527,6,Incompleta,1,0,1,"CALLE LA SEMITA NÚMERO EXTERIOR: SN, RANCHO O RANCHERIA LA SEMITA, CÓDIGO POSTAL 37915, ENTRE CALLE NINGUNO, Y CALLE NINGUNO, POSTERIOR CALLE NINGUNO",216,LA SEMITA,33,San Luis de la Paz,ISABEL ESMERALDA LUGO SALAZAR
11KJN1194G,PREESCOLAR COMUNITARIO,1,Matutino,3,88,No aplica,0,0,0,LA VENTANA,232,LA VENTANA (LA VENTANA PUERTO BLANCO),33,San Luis de la Paz,FRANCISCO JAVIER CRUZ OTERO
