NO_APLICA,NO_APLICA,1,Matutino,0,0,No aplica,,,,NO APLICA,0,NO APLICA,0,NO APLICA,NO APLICA
11ETV0160O,TELESECUNDARIA NUM. 165,1,Matutino,525,6,Completa,0,0,0,"CALLE ALLENDE PONIENTE NÚMERO EXTERIOR: SN, PUEBLO EL CAPULIN, CÓDIGO POSTAL 37991, ENTRE CALLE MORELOS, Y CALLE IGNACIO ZARAGOZA, POSTERIOR CALLE FRANCISCO JAVIER MINA",15,EL CAPULIN,32,San José Iturbide,ANA PAULINA RODRIGUEZ ESQUINA
11BBI0127Z,BIBLIOTECA PUBLICA MUNICIPAL GONZALO ZARAZUA,4,Discontinuo,888,88,No aplica,0,0,0,HIDALGO NUM. 11,15,EL CAPULIN,32,San José Iturbide,ANA LUZ ROBLES ROBLES
11DJN3178T,SANTOS DEGOLLADO,1,Matutino,47,7,Completa,0,0,0,"CALLE ESPAÑITA NÚMERO EXTERIOR: SN, RANCHERIA ESPAÑITA, CÓDIGO POSTAL 37987, ENTRE CALLE SALAMANCA, Y CALLE NINGUNO, POSTERIOR CALLE EL PARQUECITO",33,ESPAÑITA,32,San José Iturbide,CYNTHIA ANDREA GONZALEZ RICO
11DPR2834Z,RICARDO FLORES MAGON,2,Vespertino,17,18,No aplica,0,0,0,"CALLE PAREDES NÚMERO EXTERIOR: SN, RANCHO O RANCHERIA PAREDES, CÓDIGO POSTAL 37915, ENTRE CALLE NINGUNO, Y CALLE NINGUNO, POSTERIOR CALLE NINGUNO",126,PAREDES,33,San Luis de la Paz,PENDIENTE
11KPR0224U,CURSO COMUNITARIO,1,Matutino,3,88,No aplica,0,0,0,PASO COLORADO,127,PASO COLORADO,33,San Luis de la Paz,PENDIENTE
11DPR3474K,RAFAEL RAMIREZ,1,Matutino,147,18,Incompleta,1,0,1,PASO COLORADO,127,PASO COLORADO,33,San Luis de la Paz,MARTHA LAURA RICO MARTINEZ
11DPR0639I,HEROE DE NACOZARI,1,Matutino,57,18,Incompleta,1,0,0,"CALLE ESTACION DE POZO BLANCO NÚMERO EXTERIOR: SN,RANCHO O RANCHERIA POZO BLANCO (ESTACION POZO BLANCO), CÓDIGO POSTAL 37917, ENTRE CALLE NINGUNO, Y CALLE NINGUNO, POSTERIOR CALLE NINGUNO",145,POZO BLANCO (ESTACION POZO BLANCO),33,San Luis de la Paz,ANA LILIA CRUZ RODRIGUEZ
11DJN1166A,JOAQUIN BARANDA,1,Matutino,242,1,Incompleta,1,0,1,"CALLE LA QUINTA NÚMERO EXTERIOR: SN, RANCHO O RANCHERIA LA QUINTA DOS, CÓDIGO POSTAL 37914, ENTRE CALLE NINGUNO, Y CALLE NINGUNO, POSTERIOR CALLE NINGUNO",161,LA QUINTA DOS,33,San Luis de la Paz,ANA ISABEL TORRES TORRES
11KJN0676F,PREESCOLAR COMUNITARIO,1,Matutino,3,88,No aplica,0,0,0,LA CANELA,13,LA CANELA,32,San José Iturbide,ALMA LANDAVERDE GARCIA
11EBA0023J,C.E.B.A.S.-SEEVYT PLANTEL TIERRA BLANCA,3,Nocturno,888,88,No aplica,0,0,0,CARRETERA SAN JOSE ITURBIDE-SANTA CATARINA LOS AGUACATES,1,TIERRA BLANCA,40,Tierra Blanca,PENDIENTE
11DJN3599B,EMILIANO ZAPATA,1,Matutino,249,1,No aplica,0,0,0,LAS GRASAS,1,TIERRA BLANCA,40,Tierra Blanca,MONICA EVANGELINA HERNANDEZ CALDERON
11EJN0277Y,ROSARIO CASTELLANOS,1,Matutino,510,2,Completa,0,0,0,NIÑOS HEROES S/N,1,TIERRA BLANCA,40,Tierra Blanca,ALICIA ALVARADO WITRAGO
11FIZ0056B,SUPERVISION DE ZONA ESCOLAR DE EDUCACION PRIMARIA NUM. 56,4,Discontinuo,56,27,No aplica,0,0,0,"CALLE PLAZUELA DEL REFUGIO NÚMERO EXTERIOR: SN, PUEBLO TIERRA BLANCA, CÓDIGO POSTAL 37970, ENTRE CALLE CARRETERA SAN JOSÉ ITURBIDE SANTA CATARINA, Y CALLE RENOVACIÓN, POSTERIOR CALLE NINGUNO",1,TIERRA BLANCA,40,Tierra Blanca,OSCAR ORTEGA SILVA
11BBE0245S,BIBLIOTECA DE LA ESCUELA SECUNDARIA GENERAL SIGLO XXI,1,Matutino,888,88,No aplica,0,0,0,AVENIDA LAS CAÑAS NUM. SN,1,TIERRA BLANCA,40,Tierra Blanca,ANGELICA CAMPOS SALGADO
11ETC0010T,COLEGIO DE ESTUDIOS CIENTIFICOS Y TECNOLOGICOS DEL ESTADO DE GUANAJUATO PLANTEL TIERRA BLANCA,1,Matutino,888,88,No aplica,0,0,0,"CALLE DE CECYTEG NÚMERO EXTERIOR: SN, PUEBLO TIERRA BLANCA, CÓDIGO POSTAL 37970, ENTRE CALLE NINGUNO, Y CALLE PRIVADA DE LA CRUZ, POSTERIOR CALLE NINGUNO",1,TIERRA BLANCA,40,Tierra Blanca,EDNA JUDITH INFANTE RAMIREZ
11PJN1015Z,HELLEN KELLER ADAMS,1,Matutino,510,2,No aplica,0,0,0,CARRETERA SAN LUIS DE LA PAZ71 ESQUINA LIBRAMIENTO PTE.,1,SAN JOSE ITURBIDE,32,San José Iturbide,FIDELIA VICTORIA ZARATE
11PBT0174J,INSTITUTO MANCHESTER DE SAN JOSE,2,Vespertino,888,88,No aplica,0,0,0,ALDAMA NUM. 40,1,SAN JOSE ITURBIDE,32,San José Iturbide,AQUILES VERA SALCEDO
11DJN2921D,LIC. IGNACIO GARCIA TELLEZ,1,Matutino,47,7,Completa,0,0,0,JUAN RULFO S/N A UN LADO DEL LIBRAMIENTO LUIS FERRO MEDINA,1,SAN JOSE ITURBIDE,32,San José Iturbide,MARTHA GEORGINA NARCISO BALTIERRA
11AZP0047I,SUPERVISION DE ZONA ESCOLAR NUM. 47 (PREESCOLAR),4,Discontinuo,47,8,No aplica,0,0,0,ALDAMA NUM. 57,1,SAN JOSE ITURBIDE,32,San José Iturbide,ROSA MARIA ACEVEDO MARTINEZ
11BBI0012Z,BIBLIOTECA PUBLICA MUNICIPAL BENITO JUAREZ,4,Discontinuo,,,No aplica,0,0,0,"CALLE PLAZA PRINCIPAL NÚMERO EXTERIOR: 8 , COLONIA SAN JOSE ITURBIDE CENTRO, CÓDIGO POSTAL 37980, ENTRE CALLE BENITO JUAREZ GARCIA, Y CALLE MARIANO ABASOLO, POSTERIOR CALLE JAVIER MINA",1,SAN JOSE ITURBIDE,32,San José Iturbide,MARTHA RIVERA SUAREZ
11FTV5025Q,SUPERVISION DE ZONA ESCOLAR DE TELESECUNDARIA NUM. 525,4,Discontinuo,525,6,No aplica,0,0,0,"CALLE JAVIER MINA NÚMERO EXTERIOR: 1 , COLONIA SAN JOSE ITURBIDE CENTRO, CÓDIGO POSTAL 37980, ENTRE CALLE BENITO JUAREZ GARCIA, Y CALLE MARIANO ABASOLO, POSTERIOR CALLE PLUTARCO ELIAS CALLES",1,SAN JOSE ITURBIDE,32,San José Iturbide,ALBERTO NARVAEZ TORRES
11DJN3402A,JUAN ESCUTIA,1,Matutino,240,1,Incompleta,1,0,1,"CALLE ATONGUITO NÚMERO EXTERIOR: SN,POBLADO COMUNAL ATONGUITO, CÓDIGO POSTAL 37993, ENTRE CALLE NINGUNO, Y CALLE NINGUNO, POSTERIOR CALLE NINGUNO",9,ATONGUITO,32,San José Iturbide,ANA LAURA RUIZ BECERRA
11DJN1068Z,JUSTO SIERRA,1,Matutino,47,7,Incompleta,1,0,0,PARAISO S/N,39,EL GALOMO,32,San José Iturbide,ESTEFANIA VEGA RIVERA
11ETV1009Z,TELESECUNDARIA NUM. 1009,1,Matutino,527,6,Completa,0,0,0,"CALLE PROVIDENCIA DE LOS MOLINA NÚMERO EXTERIOR: SN, RANCHO O RANCHERIA PROVIDENCIA DE LOS MOLINA, CÓDIGO POSTAL 37917, ENTRE CALLE NINGUNO, Y CALLE NINGUNO, POSTERIOR CALLE NINGUNO",152,PROVIDENCIA DE LOS MOLINA,33,San Luis de la Paz,MARIA TERESA FLORES VIZCAYA
11KJN0254Y,PREESCOLAR COMUNITARIO,1,Matutino,3,88,No aplica,0,0,0,SAN CAYETANO,184,SAN CAYETANO,33,San Luis de la Paz,EVA GARCIA BARCENAS
11KPR3988S,CURSO COMUNITARIO,1,Matutino,3,88,No aplica,0,0,0,EL ZAPOTE (EL MICHE),47,EL ZAPOTE (EL MICHE),34,Santa Catarina,MARTHA GUADALUPE BREÑA BRIONES
11EJN0222V,ALVARO OBREGON,1,Matutino,506,2,No aplica,0,0,0,LA SIMONA,82,LA SIMONA,43,Victoria,PERLA FABIOLA APODACA FLORES
11PJN0050Z,INSTITUTO GLENN DOMAN,1,Matutino,47,7,No aplica,0,0,0,"PROLONGACIÓN MOCTEZUMA NÚMERO EXTERIOR: 64 , COLONIA EL PINITO, CÓDIGO POSTAL 37985, ENTRE PROLONGACIÓN LIBRAMIENTO PONIENTE, Y CALLE 20 DE NOVIEMBRE, POSTERIOR CALLE 16 DE SEPTIEMBRE",1,SAN JOSE ITURBIDE,32,San José Iturbide,MARIA IGNACIA ZARAZUA RUBIO
11PJN0818I,MORITA,1,Matutino,510,2,No aplica,0,0,0,PROLONGACION MORELOS NUM. 63-B,1,SAN JOSE ITURBIDE,32,San José Iturbide,DULCE MARIA MATA RANGEL
11PBH0265F,COLEGIO JUAN JOSE TORRES LANDA,2,Vespertino,888,88,No aplica,0,0,0,JOSE CAMARILLO NUM. 99-A CALLE DEL CANAL,1,SAN JOSE ITURBIDE,32,San José Iturbide,CECILIA ESPINO MONTES
11DPT0012W,PLANTEL CONALEP 270. SAN JOSE ITURBIDE,1,Matutino,888,88,No aplica,0,0,0,AVENIDA CONALEP NUM. 104,1,SAN JOSE ITURBIDE,32,San José Iturbide,ELIA GAYTAN ALCARAZ
11DML0033C,CENTRO DE ATENCION MULTIPLE SAN JOSE ITURBIDE,1,Matutino,8,88,No aplica,0,0,0,HUIZACHE S/N ESQUINA CON CIPRES,1,SAN JOSE ITURBIDE,32,San José Iturbide,NICOLAS PEREZ LOPEZ
11BBI0210Z,BIBLIOTECA PUBLICA MUNICIPAL MANUEL GOMEZ MORIN,2,Vespertino,888,88,No aplica,0,0,0,MANUEL RODRIGUEZ NUM. 120,1,SAN JOSE ITURBIDE,32,San José Iturbide,MICAELA IBARRA SALAZAR
11PSU0225Z,CENTRO UNIVERSITARIO NICOLAS CAMPA,4,Discontinuo,,,No aplica,0,0,0,"CALLE HIDALGO NÚMERO EXTERIOR: 12 , COLONIA SAN JOSE ITURBIDE CENTRO, CÓDIGO POSTAL 37980, ENTRE CALLE MELCHOR OCAMPO, Y CALLE MIGUEL MA. ECHEGARAY, POSTERIOR CALLE GALEANA",1,SAN JOSE ITURBIDE,32,San José Iturbide,JUAN CARLOS SALGADO GUZMAN
11PPR1005J,COLEGIO LA. MARIE JOSEPH MOTIER LAFAYETTE,1,Matutino,514,2,No aplica,0,0,0,"AVENIDA LIBRAMIENTO ORIENTE NÚMERO EXTERIOR: 71 , COLONIA EL TEPETATE, CÓDIGO POSTAL 37984, ENTRE CALLE LATERAL MOCTEZUMA, Y CALLE MIGUEL HIDALGO Y COSTILLA, POSTERIOR CALLE NINGUNO",1,SAN JOSE ITURBIDE,32,San José Iturbide,MA. CONSUELO PEÑA PANIAGUA
11PBT0025B,ACADEMIA ESCOI,2,Vespertino,888,88,No aplica,0,0,0,"CALLE ALLENDE NÚMERO EXTERIOR: 24 , COLONIA SAN JOSE ITURBIDE CENTRO, CÓDIGO POSTAL 37980, ENTRE CALLE ZARAGOZA, Y CALLE BENITO JUÁREZ, POSTERIOR CALLE JAVIER MINA",1,SAN JOSE ITURBIDE,32,San José Iturbide,MARIA GLORIA ESQUEDA ARVIZU
11FIZ0186V,SUPERVISION DE ZONA ESCOLAR DE EDUCACION PRIMARIA NUM. 186,4,Discontinuo,186,21,No aplica,0,0,0,"CALLE JAVIER MINA NÚMERO EXTERIOR: 1 , COLONIA SAN JOSE ITURBIDE CENTRO, CÓDIGO POSTAL 37980, ENTRE CALLE BENITO JUAREZ GARCIA, Y CALLE MARIANO ABASOLO, POSTERIOR CALLE PLUTARCO ELIAS CALLES",1,SAN JOSE ITURBIDE,32,San José Iturbide,SILVIA PATIÑO VAZQUEZ
11DPR3086T,BENITO JUAREZ,1,Matutino,180,21,Incompleta,1,0,0,LA CANELA,13,LA CANELA,32,San José Iturbide,MARIA REMEDIOS ALVARADO SORIA
11DPR0262N,EJERCITO MEXICANO,1,Matutino,21,21,Completa,0,0,0,CERRITO DEL ARENAL,18,EL CERRITO DEL ARENAL,32,San José Iturbide,ABELARDO PALOMINO GONZALEZ
11DJN3665K,NIÑOS HEROES,1,Matutino,47,7,Completa,0,0,0,5 DE MAYO,20,CINCO DE MAYO,32,San José Iturbide,MA. CARMEN OLVERA FLORES
11DPR0268H,FRANCISCO I. MADERO,1,Matutino,180,21,Completa,0,0,0,"CALLE HIDALGO NÚMERO EXTERIOR: SN, RANCHO O RANCHERIA LA FRAGUA, CÓDIGO POSTAL 37990, ENTRE CALLE ALVARO OBREGON, Y AVENIDA QUERETARO - SAN LUIS POTOSI, POSTERIOR AVENIDA QUERETARO - SAN LUIS POTOSI",38,LA FRAGUA,32,San José Iturbide,JUAN CARLOS DOMINGUEZ SUASTE
11DPR0297C,RAUL CORDERO,1,Matutino,118,18,Completa,0,0,0,"CALLE POZO HONDO (EX-HACIENDA DE POZO HONDO) NÚMERO EXTERIOR: SN, HACIENDA POZO HONDO (EX-HACIENDA DE POZO HONDO), CÓDIGO POSTAL 37916, ENTRE CALLE NINGUNO, Y CALLE NINGUNO, POSTERIOR CALLE NINGUNO",148,POZO HONDO (EX-HACIENDA DE POZO HONDO),33,San Luis de la Paz,JUAN CARLOS BRIONES MATA
11EJN1045O,JARDIN DE NIÑOS,1,Matutino,301,1,No aplica,0,0,0,YERBABUENA,35,LA YERBABUENA,34,Santa Catarina,MA. DEL CARMEN TINAJERO
11EBS0023I,C.E.B.A.S.-SEEVYT PLANTEL TIERRA BLANCA,3,Nocturno,888,88,No aplica,0,0,0,CARRETERA SAN JOSE ITURBIDE-SANTA CATARINA LOS AGUACATES,1,TIERRA BLANCA,40,Tierra Blanca,PENDIENTE
11KJN1402X,PREESCOLAR COMUNITARIO,1,Matutino,3,88,No aplica,0,0,0,TORTUGAS,52,TORTUGAS,45,Xichú,ERIC RAMIREZ LOPEZ
11ETV0649N,TELESECUNDARIA NUM. 683,1,Matutino,527,6,Completa,0,0,0,"CALLE DERRAMADERO SEGUNDO INFIERNILLO NÚMERO EXTERIOR: SN,RANCHO O RANCHERIA DERRAMADERO SEGUNDO (INFIERNILLO), CÓDIGO POSTAL 37915, ENTRE CALLE NINGUNO, Y CALLE NINGUNO, POSTERIOR CALLE NINGUNO",394,DERRAMADERO SEGUNDO (INFIERNILLO),33,San Luis de la Paz,TOMASA VELAZQUEZ PADRON
11KJN1563J,PREESCOLAR COMUNITARIO,1,Matutino,3,88,Incompleta,1,0,0,"CALLE SALITRERA NÚMERO EXTERIOR: SN, RANCHO O RANCHERIA SALITRERA, CÓDIGO POSTAL 00000, ENTRE CALLE NINGUNO, Y CALLE NINGUNO, POSTERIOR CALLE NINGUNO",76,SALITRERA,43,Victoria,MARTHA GUADALUPE BREÑA BRIONES
11EJN1025A,JOSEFA ORTIZ,1,Matutino,301,1,No aplica,0,0,0,ROSA DE CASTILLA,46,ROSA DE CASTILLA,45,Xichú,CONSUELO SAAVEDRA GARCIA
11KJN1199B,PREESCOLAR COMUNITARIO,1,Matutino,3,88,No aplica,0,0,0,EL ROBLAR,64,EL ROBLAR,45,Xichú,MARIA MERCED VELAZQUEZ GONZALEZ
11EPR0811Z,JOSE MA. MORELOS Y PAVON,1,Matutino,511,2,No aplica,0,0,0,LA CEBADA,25,LA CEBADA,33,San Luis de la Paz,SANDRA ELVIRA JIMENEZ BRITO
11DPR3821B,NIÑOS HEROES,1,Matutino,158,27,Incompleta,1,1,0,ALLENDE S/N,32,EL TABLON,34,Santa Catarina,JORGE ARIEL RAMIREZ MARTINEZ
11KPR3987T,CURSO COMUNITARIO,1,Matutino,3,88,No aplica,0,0,0,"CALLEJON MESA PRIETA NÚMERO EXTERIOR: SN, RANCHO O RANCHERIA MESA PRIETA, CÓDIGO POSTAL 37923, ENTRE CALLE NINGUNO, Y CALLE NINGUNO, POSTERIOR CALLE NINGUNO",132,MESA PRIETA,43,Victoria,RAMIRO FLORES BOULLOSA
11KPR0265U,CURSO COMUNITARIO,1,Matutino,3,88,Incompleta,1,0,1,"CALLE LOS TANQUES NÚMERO EXTERIOR: SN, RANCHO O RANCHERIA ORGANITOS, CÓDIGO POSTAL 37933, ENTRE CALLE NINGUNO, Y CALLE NINGUNO, POSTERIOR CALLE NINGUNO",73,LOS TANQUES,45,Xichú,SAUL SALAZAR BARBOSA
11KJN1045Z,PREESCOLAR COMUNITARIO,1,Matutino,3,88,No aplica,0,0,0,EL TEPEHUAJE,85,EL TEPEHUAJE,43,Victoria,JESUS MENDEZ
11DJN3096J,GABRIELA MISTRAL,1,Matutino,239,1,Incompleta,1,0,1,"CALLE LA ALAMEDA NÚMERO EXTERIOR: SN,HACIENDA LA ALAMEDA, CÓDIGO POSTAL 37997, ENTRE CALLE NINGUNO, Y CALLE NINGUNO, POSTERIOR CALLE NINGUNO",4,LA ALAMEDA,32,San José Iturbide,MARIA CIRENIA ROBLES PEREZ
11DJN2559U,JUAN BAUTISTA MORALES,1,Matutino,47,7,Incompleta,1,1,0,"CALLE HIDALGO NÚMERO EXTERIOR: SN, RANCHO O RANCHERIA LA FRAGUA, CÓDIGO POSTAL 37990, ENTRE CALLE ALVARO OBREGON, Y AVENIDA QUERETARO - SAN LUIS POTOSI, POSTERIOR CALLE NINGUNO",38,LA FRAGUA,32,San José Iturbide,ANA KAREN RAMIREZ ROSAS
11DJN4009E,JOSE MA. MORELOS Y PAVON,1,Matutino,243,1,No aplica,0,0,0,PRAGA,150,PRAGA,33,San Luis de la Paz,ANGELICA LUGO MORALES
11KJN0347N,PREESCOLAR COMUNITARIO,1,Matutino,3,88,Incompleta,1,1,0,RANCHO NUEVO S/N,164,RANCHO NUEVO,33,San Luis de la Paz,BERNARDINA MORALES HERNANDEZ
11DJN2396Z,JOSEFA ORTIZ DE DOMINGUEZ,1,Matutino,41,7,No aplica,0,0,0,EL REFUGIO,166,EL REFUGIO,33,San Luis de la Paz,PENDIENTE
11DJN0780H,JARDIN DE NIÑOS,1,Matutino,243,1,No aplica,0,0,0,SAN ANTON DE LOS MARTINEZ,173,SAN ANTON DE LOS MARTINEZ,33,San Luis de la Paz,MA. DEL CARMEN GARCIA RODRIGUEZ
11DPR0551E,CUAUHTEMOC,1,Matutino,56,27,Completa,0,0,0,"CALLE NIÑOS HÉROES NÚMERO EXTERIOR: SN, PUEBLO TIERRA BLANCA, CÓDIGO POSTAL 37970, ENTRE CALLE 16 DE SEPTIEMBRE, Y CALLE RENOVACIÓN, POSTERIOR CALLE 16 DE SEPTIEMBRE",1,TIERRA BLANCA,40,Tierra Blanca,ESMERALDA GALLEGOS Y GARCIA
11FEI0246G,MODULO DE ATENCION Y SERVICIOS,4,Discontinuo,888,88,No aplica,0,0,0,CARRETERA SAN JOSE ITURBIDE-SANTA CATARINA,1,TIERRA BLANCA,40,Tierra Blanca,J. JESUS VAZQUEZ HERNANDEZ
11KJN1311F,PREESCOLAR COMUNITARIO,1,Matutino,3,88,No aplica,0,0,0,LAS VEREDAS,94,LAS VEREDAS,43,Victoria,PENDIENTE
11PBH0176M,CENTRO PATRIA DE SAN JOSE ITURBIDE,1,Matutino,888,88,No aplica,0,0,0,"AVENIDA LIBRAMIENTO ORIENTE NÚMERO EXTERIOR: 2 , COLONIA LOMA DE GUADALUPE, CÓDIGO POSTAL 00000, ENTRE CALLE IGNACIO ZARAGOZA, Y CALLE FERMÍN ESPINOZA, POSTERIOR CALLE JUDEA",1,SAN JOSE ITURBIDE,32,San José Iturbide,BEATRIZ HELGUERA NIETO
11FUA0117L,"UNIDAD DE SERVICIOS DE APOYO A LA EDUCACION REGULAR NUM. 117 ""LEO KANNER""",1,Matutino,8,88,No aplica,0,0,0,"PROLONGACIÓN JUÁREZ NÚMERO EXTERIOR: SN, COLONIA SAN JOSE ITURBIDE CENTRO, CÓDIGO POSTAL 37980, ENTRE CALLE MANUEL BENÍTEZ, Y CALLE MANUEL RODRÍGUEZ, POSTERIOR CALLE KARLA SÁNCHEZ",1,SAN JOSE ITURBIDE,32,San José Iturbide,PENDIENTE
11PDI0064F,EL GUARDIAN DE LA INOCENCIA,1,Matutino,1,88,No aplica,0,0,0,CARRETERA SALIDA A QUERETARO,1,SAN JOSE ITURBIDE,32,San José Iturbide,MARTHA GEORGINA NARCISO BALTIERRA
11FEI0225U,MODULO DE ATENCION Y SERVICIOS,4,Discontinuo,888,88,No aplica,0,0,0,CHUPARROSA NUM. 215,1,SAN JOSE ITURBIDE,32,San José Iturbide,CONCEPCION HERNANDEZ HERNANDEZ
11EES0036J,PORVENIR,1,Matutino,514,2,No aplica,0,0,0,MOCTEZUMA NUM. SN CARRETERA ITURBIDE-QUERETARO A LA 57,1,SAN JOSE ITURBIDE,32,San José Iturbide,ARNALDO HERNANDEZ ACOSTA
11DPR2920V,JAIME TORRES BODET,2,Vespertino,186,21,Completa,0,0,0,GOMEZ FARIAS S/N AUN LADO DEL PREESCOLAR ANTONIO CASO,1,SAN JOSE ITURBIDE,32,San José Iturbide,MARCO ANTONIO GRIMALDO VELAZCO
11PJN0983H,COLEGIO LA. MARIE JOSEPH MOTIER LAFAYETTE,1,Matutino,510,2,No aplica,0,0,0,"AVENIDA LIBRAMIENTO ORIENTE NÚMERO EXTERIOR: 71 , COLONIA EL TEPETATE, CÓDIGO POSTAL 37984, ENTRE CALLE LATERAL MOCTEZUMA, Y CALLE MIGUEL HIDALGO Y COSTILLA, POSTERIOR CALLE NINGUNO",1,SAN JOSE ITURBIDE,32,San José Iturbide,MARIA JOSE BARRUETA MORALES
11PJN0174H,FRAY LUIS DE LEON,1,Matutino,510,2,No aplica,0,0,0,"CALLE JUÁREZ NÚMERO EXTERIOR: 19 , COLONIA SAN JOSE ITURBIDE CENTRO, CÓDIGO POSTAL 37980, ENTRE CALLE JAVIER MINA, Y CALLE PLUTARCO ELÍAS CALLES, POSTERIOR CALLE IGNACIO ZARAGOZA",1,SAN JOSE ITURBIDE,32,San José Iturbide,MARIA GUADALUPE ARVIZU GUDIÑO
11PBT0026A,ACADEMIA LUCITA,1,Matutino,888,88,No aplica,0,0,0,"CALLE JUÁREZ NÚMERO EXTERIOR: 19 , COLONIA SAN JOSE ITURBIDE CENTRO, CÓDIGO POSTAL 37980, ENTRE CALLE JAVIER MINA, Y CALLE PLUTARCO ELÍAS CALLES, POSTERIOR CALLE IGNACIO ZARAGOZA",1,SAN JOSE ITURBIDE,32,San José Iturbide,GUADALUPE GUDIÑO ARVIZU
11FIZ0021M,SUPERVISION DE ZONA ESCOLAR DE EDUCACION PRIMARIA NUM. 21,4,Discontinuo,21,21,No aplica,0,0,0,"CALLE JAVIER MINA NÚMERO EXTERIOR: 1 , COLONIA SAN JOSE ITURBIDE CENTRO, CÓDIGO POSTAL 37980, ENTRE CALLE BENITO JUAREZ GARCIA, Y CALLE MARIANO ABASOLO, POSTERIOR CALLE PLUTARCO ELIAS CALLES",1,SAN JOSE ITURBIDE,32,San José Iturbide,MARIA GUADALUPE MEZA CORDOBA
11DPR3144T,SANTOS DEGOLLADO,2,Vespertino,21,21,No aplica,0,0,0,BUENAVISTILLA,10,BUENAVISTILLA,32,San José Iturbide,MA. JOSEFINA BUSTOS FUENTES
11DPR3145S,JUAN ALVAREZ,1,Matutino,21,21,Incompleta,1,1,0,"AVENIDA MIGUEL HIDALGO NÚMERO EXTERIOR: SN, COLONIA LA CANTERA, CÓDIGO POSTAL 37986, ENTRE PRIVADA LA LOMA, Y CALLE NINGUNO, POSTERIOR CALLE NINGUNO",14,LA CANTERA,32,San José Iturbide,MARY CRUZ URIBE MENDOZA
11DPR2919F,20 DE NOVIEMBRE,2,Vespertino,21,21,No aplica,0,0,0,LA CANTERA,14,LA CANTERA,32,San José Iturbide,MARIA DEL ROCIO TELLEZ GONZALEZ
11ETC0046H,COLEGIO DE ESTUDIOS CIENTIFICOS Y TECNOLOGICOS DEL ESTADO DE GUANAJUATO PLANTEL SAN JOSE ITURBIDE,1,Matutino,888,88,No aplica,0,0,0,"CARRETERA FEDERAL NÚMERO EXTERIOR: 57 , CONGREGACION EL CAPULIN, CÓDIGO POSTAL 37991, ENTRE CALLE NINGUNO, Y CALLE NINGUNO, POSTERIOR CALLE NINGUNO",15,EL CAPULIN,32,San José Iturbide,RAFAEL ALDANA HERNANDEZ
11EJN1187M,OCTAVIO PAZ,1,Matutino,302,1,No aplica,0,0,0,CARBAJAL,17,CARBAJAL,32,San José Iturbide,ADELA GUTIERREZ RUBIO
11DJN4002L,GABINO BARREDA,1,Matutino,242,1,Incompleta,1,0,1,PASO COLORADO,127,PASO COLORADO,33,San Luis de la Paz,ESBELOY IDALI MARTINEZ MORALES
11DJN2638G,PROMOTOR BACHILLERATO,1,Matutino,241,1,No aplica,0,0,0,SAN ANTONIO CHIQUITO,176,SAN ANTONIO CHIQUITO,33,San Luis de la Paz,PENDIENTE
11EBS0017Y,C.E.B.A.S.-SEEVYT PLANTEL SAN JOSE ITURBIDE,3,Nocturno,888,88,No aplica,0,0,0,DE LA CULTURA S/N,1,SAN JOSE ITURBIDE,32,San José Iturbide,PENDIENTE
11DPR3851W,MARIA MONTESORI,1,Matutino,21,21,Completa,0,0,0,JARDINES DE CAÑADA,1,SAN JOSE ITURBIDE,32,San José Iturbide,LILIANA CARRANCO CURTIDOR
11DPR0258A,JUSTICIA SOCIAL,1,Matutino,186,21,Completa,0,0,0,GOMEZ FARIAS S/N AUN LADO DEL PREESCOLAR ANTONIO CASO,1,SAN JOSE ITURBIDE,32,San José Iturbide,MARCO ANTONIO GRIMALDO VELAZCO
11FMB0033U,CENTRO DE DESARROLLO EDUCATIVO,4,Discontinuo,888,88,No aplica,0,0,0,"CALLE JAVIER MINA NÚMERO EXTERIOR: 1 , COLONIA SAN JOSE ITURBIDE CENTRO, CÓDIGO POSTAL 37980, ENTRE CALLE BENITO JUAREZ GARCIA, Y CALLE MARIANO ABASOLO, POSTERIOR CALLE PLUTARCO ELIAS CALLES",1,SAN JOSE ITURBIDE,32,San José Iturbide,MA. LUISA GARCIA URBINA
11PES0439I,COLEGIO LA. MARIE JOSEPH MOTIER LAFAYETTE,1,Matutino,514,2,No aplica,0,0,0,"AVENIDA LIBRAMIENTO ORIENTE NÚMERO EXTERIOR: 71 , COLONIA EL TEPETATE, CÓDIGO POSTAL 37984, ENTRE CALLE LATERAL MOCTEZUMA, Y CALLE MIGUEL HIDALGO Y COSTILLA, POSTERIOR CALLE NINGUNO",1,SAN JOSE ITURBIDE,32,San José Iturbide,ESTEFANY PAOLA GUTIERREZ MARTINEZ
11AJS0021X,JEFATURA DE SECTOR DE EDUCACION PRIMARIA NUM. 21,4,Discontinuo,888,21,No aplica,0,0,0,"CALLE JAVIER MINA NÚMERO EXTERIOR: 1 , COLONIA SAN JOSE ITURBIDE CENTRO, CÓDIGO POSTAL 37980, ENTRE CALLE BENITO JUAREZ GARCIA, Y CALLE MARIANO ABASOLO, POSTERIOR CALLE PLUTARCO ELIAS CALLES",1,SAN JOSE ITURBIDE,32,San José Iturbide,RICARDO ALVARADO AGUILERA
11ETK0253Y,TELEBACHILLERATO COMUNITARIO SAN JOSE ITURBIDE LAS ADJUNTAS,1,Matutino,,,No aplica,0,0,0,"CALLE LAS ADJUNTAS NÚMERO EXTERIOR: SN,POBLADO COMUNAL LAS ADJUNTAS, CÓDIGO POSTAL 37993, ENTRE CALLE NINGUNO, Y CALLE NINGUNO, POSTERIOR CALLE NINGUNO",2,LAS ADJUNTAS,32,San José Iturbide,MAURICIO MOKARZEL ALBA
11DJN3095K,FERNANDO LATAPI,1,Matutino,238,1,No aplica,0,0,0,(DESCONOCIDO 11DJN3095K) S/N,13,LA CANELA,32,San José Iturbide,PENDIENTE
11ETV0644S,TELESECUNDARIA NUM. 670,1,Matutino,525,6,Completa,0,0,0,5 DE MAYO S/N,20,CINCO DE MAYO,32,San José Iturbide,PILAR ANTONIA RAMOS SANCHEZ
11ETV0543U,TELESECUNDARIA NUM. 534,1,Matutino,525,6,Completa,0,0,0,"CALLE HIDALGO NÚMERO EXTERIOR: SN, RANCHO O RANCHERIA LA FRAGUA, CÓDIGO POSTAL 37990, ENTRE CALLE ALVARO OBREGON, Y CALLE PASEO DE LA REPUBLICA, POSTERIOR CALLE NINGUNO",38,LA FRAGUA,32,San José Iturbide,MA. DEL SOCORRO MEDINA SAAVEDRA
11DJN1003Q,ANGELA PERALTA,1,Matutino,68,7,Completa,0,0,0,EL TOREADOR DE ENMEDIO,634,TOREADOR DE EN MEDIO,33,San Luis de la Paz,ROSA MARIA MORALES CRUZ
11ETK0294Y,TELEBACHILLERATO COMUNITARIO VICTORIA CERRITO COLORADO,2,Vespertino,888,88,No aplica,0,0,0,"CALLE CERRITO COLORADO NÚMERO EXTERIOR: SN, RANCHO O RANCHERIA CERRITO COLORADO, CÓDIGO POSTAL 37927, ENTRE CALLE NINGUNO, Y CALLE NINGUNO, POSTERIOR CALLE NINGUNO",105,CERRITO COLORADO,43,Victoria,MAURICIO MOKARZEL ALBA
11DPR2943F,FRANCISCO VILLA,1,Matutino,80,27,No aplica,0,0,0,TORTUGAS,52,TORTUGAS,45,Xichú,PENDIENTE
11EES0159T,BENITO JUAREZ GARCIA,1,Matutino,514,2,No aplica,0,0,0,"CALLE VENUSTIANO CARRANZA NÚMERO EXTERIOR: SN, PUEBLO EL CAPULIN, CÓDIGO POSTAL 37991, ENTRE CALLE JOSÉ JARAMILLO, Y AVENIDA CARRETERA SAN JOSÉ ITURBIDE - TIERRA BLANCA, POSTERIOR CALLE NINGUNO",15,EL CAPULIN,32,San José Iturbide,DANIEL CHAVEZ SILVA
11EMS0005Z,EMSAD SAN JOSE ITURBIDE (CAPULIN),1,Matutino,888,88,No aplica,0,0,0,CARRETERA ESTATAL SAN JOSE ITURBIDE-TIERRA BLANCA KILOMETRO 2.6,15,EL CAPULIN,32,San José Iturbide,EDNA JUDITH INFANTE RAMIREZ
11DJN4604D,MARIA MONTESSORI,1,Matutino,242,1,Incompleta,1,0,1,NUEVO PASO DE VAQUEROS,129,NUEVO PASO DE VAQUEROS,33,San Luis de la Paz,MARIA DE LA LUZ JIMENEZ ESPINOLA
11DPR0303X,GABRIEL RAMOS MILLAN,1,Matutino,118,18,Completa,0,0,0,SAN ISIDRO,192,SAN ISIDRO,33,San Luis de la Paz,MARIA ESTER TREJO GARCIA
11EPR0746Q,JOSE GUADALUPE VICTORIA,1,Matutino,538,2,No aplica,0,0,0,EL ZAPOTE,37,EL ZAPOTE DE CORRAL FALSO,34,Santa Catarina,ROGELIO ARVIZU QUEVEDO
11DPR2581M,20 DE NOVIEMBRE,1,Matutino,183,27,Incompleta,1,0,1,SAN AGUSTIN,77,SAN AGUSTIN,43,Victoria,MARIA DE LOURDES BRIONES LUNA
11DPR3616S,FRANCISCO VILLA,2,Vespertino,39,21,No aplica,0,0,0,GRANJA FLORENCIA,66,FLORENCIA,13,Doctor Mora,SOFIA SOSA RAMIREZ
11KJN1308S,PREESCOLAR COMUNITARIO,1,Matutino,3,88,No aplica,0,0,0,LOS CERRITOS,27,LOS CERRITOS (LOS VILLEGAS),33,San Luis de la Paz,DIEGO LOPEZ MORA
11EPR0295D,LA PAZ,1,Matutino,514,2,Completa,0,0,0,EL GALOMO,39,EL GALOMO,32,San José Iturbide,ADA FILOMENA PALACIO GALVAN
11DPR0638J,BENITO JUAREZ,1,Matutino,181,18,Completa,0,0,0,PUERTO BLANCO,153,PUERTO BLANCO DOS,33,San Luis de la Paz,CLAUDIA GABRIELA IBARRA MANZANO
11ETH0274X,VIDEOBACHILLERATO,1,Matutino,888,88,No aplica,0,0,0,SAN CAYETANO,184,SAN CAYETANO,33,San Luis de la Paz,RUBEN SALINAS TREJO
11DJN4577X,ENRIQUE C. REBSAMEN,1,Matutino,218,1,Incompleta,1,1,0,"CALLE SAN AGUSTÍN NÚMERO EXTERIOR: SN, RANCHO O RANCHERIA SAN AGUSTIN, CÓDIGO POSTAL 37967, ENTRE CALLE NINGUNO, Y CALLE NINGUNO, POSTERIOR CALLE NINGUNO",55,SAN AGUSTIN,13,Doctor Mora,SARA ORDUÑA RUBIO
11PNL0022A,INSTITUTO LA PAZ,2,Vespertino,888,88,No aplica,0,0,0,CHIMALPOPOCA NUM. 248,1,SAN LUIS DE LA PAZ,33,San Luis de la Paz,MARIA ESTELA LOPEZ GONZALEZ
11DPR3789J,RAMON LOPEZ VELARDE,2,Vespertino,168,18,Completa,0,0,0,AVENIDA CAMINO REAL S/N,1,SAN LUIS DE LA PAZ,33,San Luis de la Paz,ROSENDO DE LOS REYES ARRATIA
11KPR0366S,CURSO COMUNITARIO,1,Matutino,3,88,No aplica,0,0,0,EL VERGEL,1,SAN LUIS DE LA PAZ,33,San Luis de la Paz,PENDIENTE
11KPR0283J,CURSO COMUNITARIO,1,Matutino,3,88,No aplica,0,0,0,PUERTO DEL ZACATE,295,LAS NEGRITAS,33,San Luis de la Paz,PENDIENTE
11EPR0863F,JOSEFA MATA MOLINA,1,Matutino,511,2,Incompleta,1,1,0,"CALLE SAN PEDRO NÚMERO EXTERIOR: SN, RANCHO O RANCHERIA SAN PEDRO, CÓDIGO POSTAL 37917, ENTRE CALLE NINGUNO, Y CALLE NINGUNO, POSTERIOR CALLE NINGUNO",529,SAN PEDRO,33,San Luis de la Paz,SANDRA ELVIRA JIMENEZ BRITO
11PBT0157T,INSTITUTO DE CAPACITACION EMPRESARIAL SAN JOSE,1,Matutino,888,88,No aplica,0,0,0,PLAZA PRINCIPAL NUM. 28,1,SAN JOSE ITURBIDE,32,San José Iturbide,PENDIENTE
11BBI0145P,BIBLIOTECA PUBLICA MUNICIPAL RAMON RAMIREZ Y ARANGOITY,4,Discontinuo,888,88,No aplica,0,0,0,MANUEL PAINO NUM. 31,1,SAN JOSE ITURBIDE,32,San José Iturbide,ESMERALDA LOPEZ CABRERA
11DJN4219J,ALFONSO REYES OCHOA,2,Vespertino,47,7,Completa,0,0,0,"CALLE ALDAMA NÚMERO EXTERIOR: 7 , COLONIA SAN JOSE ITURBIDE CENTRO, CÓDIGO POSTAL 37980, ENTRE CALLE GÓMEZ FARÍAS, Y CALLE CUAUHTÉMOC, POSTERIOR CALLE SANTOS DEGOLLADO",1,SAN JOSE ITURBIDE,32,San José Iturbide,MA. CARMEN OLVERA FLORES
11PET0134F,ESCUELA COMERCIAL ITURBIDE,1,Matutino,,,No aplica,0,0,0,"CALLE ALLENDE NÚMERO EXTERIOR: 24 , COLONIA SAN JOSE ITURBIDE CENTRO, CÓDIGO POSTAL 37980, ENTRE CALLE ZARAGOZA, Y CALLE BENITO JUÁREZ, POSTERIOR CALLE JAVIER MINA",1,SAN JOSE ITURBIDE,32,San José Iturbide,GLORIA ESQUEDA ARVIZU
11FZP0047D,SUPERVISION DE ZONA ESCOLAR DE EDUCACION PREESCOLAR NUM. 47,4,Discontinuo,47,7,No aplica,0,0,0,"CALLEJON MORELOS NÚMERO EXTERIOR: 21 C, COLONIA SAN JOSE ITURBIDE CENTRO, CÓDIGO POSTAL 37980, ENTRE CALLE MORELOS, Y CALLE MELCHOR OCAMPO, POSTERIOR CALLE IGNACIO LÓPEZ RAYÓN",1,SAN JOSE ITURBIDE,32,San José Iturbide,KARINA IVONNE HURTADO PUGA
11ETV0350F,TELESECUNDARIA NUM. 358,1,Matutino,525,6,Completa,0,0,0,"CALLE CERRITO DEL ARENAL NÚMERO EXTERIOR: SN, POBLADO COMUNAL EL CERRITO DEL ARENAL, CÓDIGO POSTAL 37988, ENTRE CALLE NINGUNO, Y CALLE NINGUNO, POSTERIOR CALLE NINGUNO",18,EL CERRITO DEL ARENAL,32,San José Iturbide,JOSE HERIBERTO HERNANDEZ VARGAS
11EJN0932V,VASCO DE QUIROGA,1,Matutino,510,2,Incompleta,1,1,0,CERRITO DEL ARENAL,18,EL CERRITO DEL ARENAL,32,San José Iturbide,YESLIA ROBLES PEREZ
11DPR0290J,FRANCISCO I. MADERO,1,Matutino,168,18,Incompleta,1,0,1,SAN ANTON DE LOS MARTINEZ,173,SAN ANTON DE LOS MARTINEZ,33,San Luis de la Paz,FERNANDO GALICIA ELIAS
11EJN1005N,NIÑOS HEROES,1,Matutino,301,1,Incompleta,1,0,1,LOS AGUACATES S/N AUN COSTADO DEL CECYTEG,1,TIERRA BLANCA,40,Tierra Blanca,MA. REMEDIOS PEREZ HERNANDEZ
11KJN0786L,PREESCOLAR COMUNITARIO,1,Matutino,3,88,No aplica,0,0,0,SAN ANTONIO DE LA CUEVA,78,SAN ANTONIO DE LA CUEVA,43,Victoria,GLORIA PEREZ GARCIA
