NO_APLICA,NO_APLICA,1,Matutino,0,0,No aplica,,,,NO APLICA,0,NO APLICA,0,NO APLICA,NO APLICA
11DJN2478J,LAZARO CARDENAS,1,Matutino,97,7,Completa,0,0,0,"CALLE IGNACIO ZARAGOZA NÚMERO EXTERIOR: SN, PUEBLO EL CAPULIN, CÓDIGO POSTAL 37991, ENTRE CALLE FRANCISCO JAVIER MINA, Y CALLE ALLENDE, POSTERIOR CALLEJON DE ALLENDE",15,EL CAPULIN,32,San José Iturbide,VERONICA LOPEZ RAMIREZ
11DPR0260P,NIÑOS HEROES,1,Matutino,109,21,Completa,0,0,0,"CALLE IGNACIO ZARAGOZA NÚMERO EXTERIOR: 4 , PUEBLO EL CAPULIN, CÓDIGO POSTAL 37991, ENTRE CALLE ALLENDE, Y CALLE PLAZA MORELOS, POSTERIOR CALLE PORFIRIO DÍAZ",15,EL CAPULIN,32,San José Iturbide,MARIA DOLORES MEDINA CABALLERO
11ETK0007O,TELEBACHILLERATO COMUNITARIO DE SAN JOSE ITURBIDE,2,Vespertino,888,88,No aplica,0,0,0,RANCHO LA ESCONDIDA,32,LA ESCONDIDA,32,San José Iturbide,PENDIENTE
11DPR3147Q,PINO SUAREZ,2,Vespertino,21,21,No aplica,0,0,0,LA ESPAÑITA,33,ESPAÑITA,32,San José Iturbide,MARIA DEL ROSARIO ITURRALDE PEREZ
11EJN0951J,JARDIN DE NIÑOS,1,Matutino,302,1,No aplica,0,0,0,PASO DE VAQUEROS,129,NUEVO PASO DE VAQUEROS,33,San Luis de la Paz,ISIDRA CARDENAS PONCE
11DJN4452P,EMMA GODOY,1,Matutino,241,1,Incompleta,1,0,1,"CALLE DEL MANGO NÚMERO EXTERIOR: SN, RANCHERIA LOS PLATANOS, CÓDIGO POSTAL 37916, ENTRE CALLE DEL MANGO, Y CALLE DEL MANGO, POSTERIOR CALLE NINGUNO",143,LOS PLATANOS,33,San Luis de la Paz,SUSANA SALDIVAR BERNAL
11ETH0226N,VIDEOBACHILLERATO,1,Matutino,,,No aplica,0,0,0,"CALLE PRINCIPAL NÚMERO EXTERIOR: 1 , RANCHO O RANCHERIA POZO BLANCO (ESTACION POZO BLANCO), CÓDIGO POSTAL 37917, ENTRE CALLE NINGUNO, Y CALLE NINGUNO, POSTERIOR CALLE NINGUNO",145,POZO BLANCO (ESTACION POZO BLANCO),33,San Luis de la Paz,DANIEL ZAMARRON PEREZ
11DPR2191X,HERMANOS FLORES MAGON,1,Matutino,17,18,No aplica,0,0,0,SAN ANTONIO CHIQUITO,176,SAN ANTONIO CHIQUITO,33,San Luis de la Paz,ANGEL GALLEGOS FRAGOSO
11DPR1042I,CUAUHTEMOC,1,Matutino,118,18,Incompleta,1,0,1,SAN ANTONIO DE LAS VIEJAS,177,SAN ANTONIO DE LAS VIEJAS,33,San Luis de la Paz,CLAUDIA MARIA GALVAN PRADO
11ETK0008N,TELEBACHILLERATO COMUNITARIO DE SAN LUIS DE LA PAZ,2,Vespertino,888,88,No aplica,0,0,0,"CALLE SAN ISIDRO NÚMERO EXTERIOR: SN, RANCHO O RANCHERIA SAN ISIDRO, CÓDIGO POSTAL 37914, ENTRE CALLE NINGUNO, Y CALLE NINGUNO, POSTERIOR CALLE NINGUNO",192,SAN ISIDRO,33,San Luis de la Paz,PENDIENTE
11DPR3380W,NICOLAS BRAVO,1,Matutino,167,18,Incompleta,1,0,0,"CALLE SAN JOSÉ DEL CARMEN (EL CASCARERO) NÚMERO EXTERIOR: SN, RANCHO O RANCHERIA SAN JOSE DEL CARMEN (EL CASCARERO), CÓDIGO POSTAL 37914, ENTRE CALLE NINGUNO, Y CALLE NINGUNO, POSTERIOR CALLE NINGUNO",196,SAN JOSE DEL CARMEN (EL CASCARERO),33,San Luis de la Paz,VICENTE GUERRERO CASTILLO
11KJN0290C,PREESCOLAR COMUNITARIO,1,Matutino,3,88,No aplica,0,0,0,LA ESTANCIA,36,LA ESTANCITA DEL CAPULIN,32,San José Iturbide,PENDIENTE
11DPR3573K,NARCISO MENDOZA,2,Vespertino,180,21,No aplica,0,0,0,"CALLE HIDALGO NÚMERO EXTERIOR: SN, RANCHO O RANCHERIA LA FRAGUA, CÓDIGO POSTAL 37990, ENTRE CALLE ALVARO OBREGON, Y AVENIDA QUERETARO - SAN LUIS POTOSI, POSTERIOR AVENIDA QUERETARO - SAN LUIS POTOSI",38,LA FRAGUA,32,San José Iturbide,MARIA NORMA PALOMINO GONZALEZ
11DPR3390C,JAIME NUNO,1,Matutino,180,21,Incompleta,1,1,0,EL HUIZACHE DE GALOMO,45,EL HUIZACHE DE GALOMO,32,San José Iturbide,JUANA LIZBETH COVARRUBIAS PADRON
11EJN1118Q,JOSE VASCONCELOS,1,Matutino,510,2,Incompleta,1,1,0,EL PINITO,254,EL PINITO,32,San José Iturbide,JENNIFER NAÑEZ NAVARRO
11DJN4000N,LEONARDO DA VINCI,1,Matutino,241,1,Incompleta,1,1,0,"CALLE POZO BLANCO NÚMERO EXTERIOR: SN, RANCHO O RANCHERIA POZO BLANCO, CÓDIGO POSTAL 37914, ENTRE CALLE NINGUNO, Y CALLE CORRALES AYALA, POSTERIOR CALLE NINGUNO",146,POZO BLANCO,33,San Luis de la Paz,ALEJANDRA GUADALUPE MEJIA CORTES
11BBI0054Y,BIBLIOTECA PUBLICA MUNICIPAL SOCRATES,4,Discontinuo,888,88,No aplica,0,0,0,PRIVADA GALLEGOS S/N,1,TIERRA BLANCA,40,Tierra Blanca,AMELIA CONTRERAS GARCIA
11PSU0284O,CENTRO UNIVERSITARIO ITURBIDE,4,Discontinuo,888,88,No aplica,0,0,0,MORELOS NUM. 21 BIS,1,SAN JOSE ITURBIDE,32,San José Iturbide,CELIA TAPIA ZARAZUA
11PBH0168D,FRAY LUIS DE LEON,1,Matutino,888,88,No aplica,0,0,0,"CALLE JUÁREZ NÚMERO EXTERIOR: 19 , COLONIA SAN JOSE ITURBIDE CENTRO, CÓDIGO POSTAL 37980, ENTRE CALLE JAVIER MINA, Y CALLE PLUTARCO ELÍAS CALLES, POSTERIOR CALLE IGNACIO ZARAGOZA",1,SAN JOSE ITURBIDE,32,San José Iturbide,MA. GUADALUPE ARVIZU GUDIÑO
11ETV1011N,TELESECUNDARIA NUM. 1011,1,Matutino,549,6,Completa,0,0,0,RANCHO ORTEGA,21,ORTEGA,34,Santa Catarina,MARIA GUADALUPE GONZALEZ MARTINEZ
11EPR0045Y,REVOLUCION MEXICANA,1,Matutino,537,2,Incompleta,1,0,1,LA CIENEGUITA NUM. NO APLICA NO APLICA,13,LA CIENEGUITA,45,Xichú,AURORA ROCIO TINAJERO VAZQUEZ
11KJN0694V,PREESCOLAR COMUNITARIO,1,Matutino,3,88,No aplica,0,0,0,PROGRESO,87,EL PROGRESO,40,Tierra Blanca,JOSE CRISTOBAL ISRAEL LANDAVERDE GARCIA
11ETV0810Z,TELESECUNDARIA NUM. 810 MARIE Y PIERRE CURIE,1,Matutino,549,6,Incompleta,1,0,1,"CALLE EL TORO NÚMERO EXTERIOR: SN, POBLADO COMUNAL EL TORO, CÓDIGO POSTAL 37948, ENTRE CALLE NINGUNO, Y CALLE NINGUNO, POSTERIOR CALLE NINGUNO",22,EL TORO,6,Atarjea,RIGOBERTO AZPEITIA TELLO
11ESU0058M,UNIDEG (PLANTEL SAN JOSE ITURBIDE),4,Discontinuo,,,No aplica,0,0,0,"AVENIDA CARRETERA SAN LUIS DE LA PAZ KILÓMETRO .5 NÚMERO EXTERIOR: SN, COLONIA LA LLORONA 1A. SECC., CÓDIGO POSTAL 37983, ENTRE NINGUNO LIBRAMIENTO PONIENTE, Y CALLE PRESIDENTE JOSÉ HERNÁNDEZ ALCOCER, POSTERIOR CALLE EL SALITRE",1,SAN JOSE ITURBIDE,32,San José Iturbide,MIGUEL VARGAS MENDOZA
11KJN1044Z,PREESCOLAR COMUNITARIO,1,Matutino,3,88,Incompleta,1,0,1,EL ZORRILLO,116,EL ZORRILLO,32,San José Iturbide,MONICA VILLEGAS MENDEZ
11DJN4170H,PABLO MONTESINOS,1,Matutino,249,1,Incompleta,1,0,1,EL NOGAL,20,EL NOGAL,34,Santa Catarina,MARIA ADELA RESENDIZ SALINAS
11DPR1103F,JUAN ALDAMA,1,Matutino,158,27,Incompleta,1,1,0,"EJIDO PAREDES NÚMERO EXTERIOR: SN, RANCHO O RANCHERIA PAREDES, CÓDIGO POSTAL 37954, ENTRE CALLE NINGUNO, Y CALLE NINGUNO, POSTERIOR CALLE NINGUNO",22,PAREDES,34,Santa Catarina,FABIOLA QUIROZ GARCIA
11DJN4308C,GABRIELA MISTRAL,1,Matutino,248,1,Incompleta,1,0,1,"CALLE LAS CHIVAS NÚMERO EXTERIOR: SN, RANCHO O RANCHERIA LAS CHIVAS, CÓDIGO POSTAL 37925, ENTRE CALLE NINGUNO, Y CALLE NINGUNO, POSTERIOR CALLE NINGUNO",25,LAS CHIVAS,43,Victoria,ALMA DELIA ESPINOLA TINAJERO
11KJN0538D,PREESCOLAR COMUNITARIO,1,Matutino,3,88,No aplica,0,0,0,LAS CHIVAS,25,LAS CHIVAS,43,Victoria,PENDIENTE
11DPR2199P,MARGARITA MAZA DE JUAREZ,1,Matutino,183,27,Incompleta,1,1,0,LA ESPERANZA,27,LA ESPERANZA,43,Victoria,FERNANDO HERNANDEZ RAMIREZ
11EJN1178E,JARDIN DE NIÑOS,1,Matutino,302,1,No aplica,0,0,0,JESUS MARIA DE ABAJO,129,JESUS MARIA DE ABAJO,32,San José Iturbide,ADRIANA MARISOL CARDENAS GONZALEZ
11KJN0776E,PREESCOLAR COMUNITARIO,1,Matutino,3,88,No aplica,0,0,0,MESA DEL PUEBLO,105,MESA DEL PUEBLO,33,San Luis de la Paz,MARIBEL RIVERA PEREZ
11KPR4042M,CURSO COMUNITARIO,1,Matutino,3,88,No aplica,0,0,0,MESA DEL PUEBLO,105,MESA DEL PUEBLO,33,San Luis de la Paz,DIEGO ALFREDO LOPEZ MORA
11DPR0008V,BENITO JUAREZ,1,Matutino,118,18,Incompleta,1,0,1,"CALLE LA JARRILLA NÚMERO EXTERIOR: SN, RANCHO O RANCHERIA LA JARRILLA, CÓDIGO POSTAL 37916, ENTRE CALLE NINGUNO, Y CALLE NINGUNO, POSTERIOR CALLE NINGUNO",575,LA JARRILLA,33,San Luis de la Paz,RAUL ALBERTO MOYA GUERRERO
11DJN4001M,PROMOTOR TECNICO,1,Matutino,241,1,No aplica,0,0,0,(DESCONOCIDO 11DJN4001M) S/N,9006,"LOMA DE SAN JUAN MPIO. 029, LOC. 0043",33,San Luis de la Paz,PENDIENTE
11DJN0783E,LA REFORMA,1,Matutino,86,7,Completa,0,0,0,REVOLUCION Y FRANCISCO I. MADERO S/N,1,SANTA CATARINA,34,Santa Catarina,ALEJANDRA LOPEZ HEREDIA
11DJN0115N,VICENTE SUAREZ,1,Matutino,250,1,Incompleta,1,0,1,"CALLE OCOTERO NÚMERO EXTERIOR: SN, RANCHERIA EL OCOTERO, CÓDIGO POSTAL 37930, ENTRE CALLE NINGUNO, Y CALLE NINGUNO, POSTERIOR CALLE NINGUNO",32,EL OCOTERO,45,Xichú,MARIA DEL ROSARIO RANGEL HERNANDEZ
11FMB0006X,CENTRO DE DESARROLLO EDUCATIVO,4,Discontinuo,888,88,No aplica,0,0,0,"CALLE ZARAGOZA NÚMERO EXTERIOR: SN, RANCHERIA ATARJEA, CÓDIGO POSTAL 37940, ENTRE CALLE NINGUNO, Y CALLE NINGUNO, POSTERIOR CALLE NINGUNO",1,ATARJEA,6,Atarjea,LETICIA MARTINEZ HERNANDEZ
11FEI0207E,MODULO DE ATENCION Y SERVICIOS,4,Discontinuo,888,88,No aplica,0,0,0,EL ENCINO NUM. 87,1,ATARJEA,6,Atarjea,ADELA ESCAMILLA LAMBARRI
11KJN0313X,PREESCOLAR COMUNITARIO,1,Matutino,3,88,Incompleta,1,0,1,ALAMOS,2,ALAMOS,6,Atarjea,MACRINA ESPITIA HERNANDEZ
11EJN1141R,JOSE MARIA LUIS MORA,1,Matutino,302,1,No aplica,0,0,0,EL PATOL,66,EL PATOL,32,San José Iturbide,JOSE FELIX GARCIA JIMENEZ
11DPR3636F,VENUSTIANO CARRANZA,1,Matutino,186,21,Incompleta,1,0,0,"CALLE REFORMA NÚMERO EXTERIOR: SN, RANCHERIA LA REFORMA, CÓDIGO POSTAL 37993, ENTRE CALLE INSURGENTES, Y CALLE NINGUNO, POSTERIOR CALLE NINGUNO",83,LA REFORMA,32,San José Iturbide,GERARDO IRINEO HERNANDEZ HERNANDEZ
11DPR3028C,GRAL. LAZARO CARDENAS,2,Vespertino,181,18,No aplica,0,0,0,"CALLE EXHACIENDA DE SANTA ANA NÚMERO EXTERIOR: SN, RANCHO O RANCHERIA EX-HACIENDA DE SANTA ANA (SANTA ANA Y LOBOS), CÓDIGO POSTAL 37917, ENTRE CALLE NINGUNO, Y CALLE NINGUNO, POSTERIOR CALLE NINGUNO",209,EX-HACIENDA DE SANTA ANA (SANTA ANA Y LOBOS),33,San Luis de la Paz,CLAUDIA GABRIELA IBARRA MANZANO
11DJN3430X,ENRIQUE C. REBSAMEN,1,Matutino,241,1,Incompleta,1,0,1,LA PROVIDENCIA DEL SALITRE,462,LA PROVIDENCIA (LA PROVIDENCIA DEL SALITRE),33,San Luis de la Paz,ESMERALDA GUTIERREZ COVARRUBIAS
11DJN4337Y,MATILDE MONTOYA LAFRAGUA,1,Matutino,97,7,Completa,0,0,0,CERRO COLORADO NUM. 16 A NETZAHUALCOYOTL,9,CERRO COLORADO,40,Tierra Blanca,ALMA GARCIA GONZALEZ
11PJN0160E,MIGUEL HIDALGO,1,Matutino,0,0,No aplica,0,0,0,GUERRERO NUM. 13,1,SAN LUIS DE LA PAZ,33,San Luis de la Paz,PENDIENTE
11FEI0227S,MODULO DE ATENCION Y SERVICIOS,4,Discontinuo,888,88,No aplica,0,0,0,LEONA VICARIO NUM. 123 ECCE HOMO,1,SAN LUIS DE LA PAZ,33,San Luis de la Paz,NANCY JULIANA RESENDIZ VAZQUEZ
11FZP0097L,SUPERVISION DE ZONA ESCOLAR DE EDUCACION PREESCOLAR NUM. 97,4,Discontinuo,97,7,No aplica,0,0,0,"CALLEJON MORELOS NÚMERO EXTERIOR: 21 C, COLONIA SAN JOSE ITURBIDE CENTRO, CÓDIGO POSTAL 37980, ENTRE CALLE MORELOS, Y CALLE MELCHOR OCAMPO, POSTERIOR CALLE IGNACIO LÓPEZ RAYÓN",1,SAN JOSE ITURBIDE,32,San José Iturbide,LUZ DEL CARMEN ESCOTO GARCIA
11KPR0331C,CURSO COMUNITARIO,1,Matutino,3,88,No aplica,0,0,0,HACIENDA DE GUADALUPE,41,GUADALUPE (HACIENDA DE GUADALUPE),32,San José Iturbide,JUAN ROBLEDO ROSAS
11DPR1386C,PROFR. JUSTO SIERRA,1,Matutino,181,18,Incompleta,1,0,0,EL PRINGON,151,EL PRINGON,33,San Luis de la Paz,OLGA HILDA RUIZ TORRES
11EPR0614Z,5 DE MAYO,1,Matutino,520,2,Incompleta,1,1,0,"CALLE LA SIMONA NÚMERO EXTERIOR: SN,POBLADO COMUNAL LA SIMONA, CÓDIGO POSTAL 37927, ENTRE CALLE NINGUNO, Y CALLE NINGUNO, POSTERIOR CALLE NINGUNO",82,LA SIMONA,43,Victoria,EVA ABIGAIL GARCIA HERNANDEZ
11ETH0238S,VIDEOBACHILLERATO,1,Matutino,,,No aplica,0,0,0,"CALLE NINGUNO NÚMERO EXTERIOR: SN, RANCHO O RANCHERIA PUERTO DE LA TAPONA (LA TAPONA), CÓDIGO POSTAL 37927, ENTRE CALLE NINGUNO, Y CALLE NINGUNO, POSTERIOR CALLE NINGUNO",165,PUERTO DE LA TAPONA,43,Victoria,J CRUZ ALVAREZ CHAVEZ
11KJN1288V,PREESCOLAR COMUNITARIO,1,Matutino,3,88,Incompleta,1,0,1,"CALLE LOS TANQUES NÚMERO EXTERIOR: SN, RANCHO O RANCHERIA ORGANITOS, CÓDIGO POSTAL 37933, ENTRE CALLE NINGUNO, Y CALLE NINGUNO, POSTERIOR CALLE NINGUNO",73,LOS TANQUES,45,Xichú,SAUL SALAZAR BARBOSA
11DPR2587G,FERNANDO MONTES DE OCA,1,Matutino,33,27,Incompleta,1,0,1,SALITRERA,76,SALITRERA,43,Victoria,TULIA AURORA QUIROZ DORADO
11DPR2846D,LEONA VICARIO,2,Vespertino,33,27,No aplica,0,0,0,"CALLE CIENEGUILLA NÚMERO EXTERIOR: SN,CONGREGACION CIENEGUILLA, CÓDIGO POSTAL 37927, ENTRE CALLE NINGUNO, Y CALLE NINGUNO, POSTERIOR CALLE NINGUNO",108,CIENEGUILLA,43,Victoria,PENDIENTE
11DST0028U,SECUNDARIA TECNICA NUM. 28,1,Matutino,4,88,No aplica,0,0,0,"CALLE CIENEGUILLA NÚMERO EXTERIOR: SN,CONGREGACION CIENEGUILLA, CÓDIGO POSTAL 37927, ENTRE CALLE NINGUNO, Y CALLE NINGUNO, POSTERIOR CALLE NINGUNO",108,CIENEGUILLA,43,Victoria,ALEJANDRA ALVAREZ BAUTISTA
11ETH0089A,VIDEOBACHILLERATO,1,Matutino,,,No aplica,0,0,0,"CARRETERA A VICTORIA-SAN LUIS DE LA PAZ NÚMERO EXTERIOR: 8 KM, CONGREGACION CIENEGUILLA, CÓDIGO POSTAL 37927, ENTRE CALLE NINGUNO, Y CALLE NINGUNO, POSTERIOR CALLE NINGUNO",108,CIENEGUILLA,43,Victoria,JOSE CARLOS RAMALES JIMENEZ
11KJN1529C,PREESCOLAR COMUNITARIO,1,Matutino,3,88,Incompleta,1,0,1,"CALLE ROSA DE CASTILLA NÚMERO EXTERIOR: SN, RANCHO O RANCHERIA ROSA DE CASTILLA, CÓDIGO POSTAL 37930, ENTRE CALLE NINGUNO, Y CALLE NINGUNO, POSTERIOR CALLE NINGUNO",46,ROSA DE CASTILLA,45,Xichú,MONSERRAT DEL CARMEN CALIXTO OROZCO
11EJN0404D,JUAN MARIA GASPAR ITARD,1,Matutino,531,2,Incompleta,1,0,1,RANCHITO RANCHITO DE SAN JOSE S/N,48,RANCHITO DE SAN JOSE,13,Doctor Mora,JUANA LIZZET LÓPEZ RENTERIA
11DPR0464J,VENUSTIANO CARRANZA,1,Matutino,183,27,Incompleta,1,0,1,ALAMOS DE MARTINEZ A UN COSTADO DE LA CAPILLA,7,ALAMOS DE MARTINEZ,43,Victoria,SABAS ALEJANDRO MARTINEZ ARVIZU
11EPR0459X,NIÑOS HEROES,1,Matutino,541,2,Incompleta,1,1,0,MANGAS CUATAS,15,MANGAS CUATAS,6,Atarjea,MA. DE LA LUZ RIVAS TELLO
11FSE0013Y,SUPERVISION DE ZONA ESCOLAR NUM. 13 ESTATAL EDUCACION ESPECIAL,4,Discontinuo,13,88,No aplica,0,0,0,"AVENIDA CARRETERA SAN JOSÉ ITURBIDE SANTA CATARINA NÚMERO EXTERIOR: SN, RANCHERIA LOS AGUACATES, CÓDIGO POSTAL 37970, ENTRE CALLE CECYTEG, Y CALLE ENTRONQUE A LAS MORAS, POSTERIOR CALLE NINGUNO",1,TIERRA BLANCA,40,Tierra Blanca,VICTOR RAYMUNDO CELAYA RAMIREZ
11ADG0190C,UNIDAD DE SERVICIOS DE APOYO A LA EDUCACION TIERRA BLANCA,4,Discontinuo,,,No aplica,0,0,0,"CALLE LOS AGUACATES NÚMERO EXTERIOR: 27 A UN COSTADO DEL UNICAT, RANCHERIA LOS AGUACATES, CÓDIGO POSTAL 37970, ENTRE CARRETERA SAN JOSE ITURBIUDE SANTA CATARINA, Y CALLE CAMINO A LAS MORAS, POSTERIOR CALLE NINGUNO",1,TIERRA BLANCA,40,Tierra Blanca,OFELIA LOPEZ FELIX
11KPR0258K,CURSO COMUNITARIO,1,Matutino,3,88,No aplica,0,0,0,GATO DE PALOMAS,70,GATO DE PALOMAS,45,Xichú,DIEGO ALFREDO LOPEZ MORA
11EJN1183Q,NIÑOS HEROES,1,Matutino,301,1,No aplica,0,0,0,POTRERILLOS,77,POTRERILLOS (EL SALTO),45,Xichú,LUZ ELENA SANJUAN GARCIA
11DJN4336Z,BENITO JUAREZ,1,Matutino,218,1,Incompleta,1,0,1,"CALLE VAGUI NÚMERO EXTERIOR: SN, RANCHO O RANCHERIA VAGUI, CÓDIGO POSTAL 37965, ENTRE CALLE NINGUNO, Y CALLE NINGUNO, POSTERIOR CALLE NINGUNO",61,VAGUI,13,Doctor Mora,MIRIAM NATALI LOPEZ MENDEZ
11KPR0489B,CURSO COMUNITARIO,1,Matutino,3,88,No aplica,0,0,0,CIENEGUILLA,30,CIENEGUILLA,33,San Luis de la Paz,BEATRIZ ADRIANA PUGA RAMIREZ
11DPR2857J,ESCUELA PRIMARIA,2,Vespertino,39,21,No aplica,0,0,0,MORISQUILLAS,32,MORISQUILLAS,13,Doctor Mora,PENDIENTE
11ETK0141U,TELEBACHILLERATO COMUNITARIO SAN JOSE ITURBIDE-EL ZAPOTE,2,Vespertino,,,No aplica,0,0,0,"CALLE NINGUNO NÚMERO EXTERIOR: SN, POBLADO COMUNAL EL ZAPOTE, CÓDIGO POSTAL 37995, ENTRE CALLE NINGUNO, Y CALLE NINGUNO, POSTERIOR CALLE NINGUNO",115,EL ZAPOTE,32,San José Iturbide,MAURICIO MOKARZEL ALBA
11KJN0876D,PREESCOLAR COMUNITARIO,1,Matutino,3,88,No aplica,0,0,0,LA FLORIDA,60,LA FLORIDA,33,San Luis de la Paz,MARTHA GUADALUPE BREÑA BRIONES
11DPR3622C,ESCUELA PRIMARIA,2,Vespertino,17,18,No aplica,0,0,0,"CALLE SAN JUAN SEGUNDO NÚMERO EXTERIOR: SN, RANCHERIA SAN JUAN SEGUNDO, CÓDIGO POSTAL 37917, ENTRE CALLE NINGUNO, Y CALLE CUAUHTÉMOC, POSTERIOR CALLE NINGUNO",79,SAN JUAN SEGUNDO,33,San Luis de la Paz,ERIKA TORRES ROJAS
11KJN1357A,PREESCOLAR COMUNITARIO,1,Matutino,3,88,Incompleta,1,0,1,TOREADOR DE ARRIBA,362,TOREADOR DE ARRIBA,33,San Luis de la Paz,VIRIDIANA REYNA LUGO
11DPR3464D,JUSTO SIERRA,2,Vespertino,158,27,No aplica,0,0,0,"EJIDO PAREDES NÚMERO EXTERIOR: SN, RANCHO O RANCHERIA PAREDES, CÓDIGO POSTAL 37954, ENTRE CALLE NINGUNO, Y CALLE NINGUNO, POSTERIOR CALLE NINGUNO",22,PAREDES,34,Santa Catarina,SIMPLICIO DORADO QUIROZ
11KJN0480U,PREESCOLAR COMUNITARIO,1,Matutino,3,88,No aplica,0,0,0,SAN RAFAEL,56,SAN RAFAEL,13,Doctor Mora,PENDIENTE
11DJN4576Y,FRIDA KAHLO,1,Matutino,218,1,Incompleta,1,0,1,LA FORTUNA NUM. SN,88,LA FORTUNA,13,Doctor Mora,DELIA MEJIA ZARAZUA
11DPR0740X,BENITO JUAREZ,1,Matutino,171,27,Incompleta,1,0,1,"CALLE EL RUCIO NÚMERO EXTERIOR: SN,RANCHO O RANCHERIA EL RUCIO, CÓDIGO POSTAL 37936, ENTRE CALLE NINGUNO, Y CALLE NINGUNO, POSTERIOR CALLE NINGUNO",47,EL RUCIO,45,Xichú,MARIA GUADALUPE CHAVEZ BERNARDO
11DJN4462W,BENITO JUAREZ,1,Matutino,250,1,Incompleta,1,0,1,"CALLE LA SALITRERA NÚMERO EXTERIOR: SN,RANCHO O RANCHERIA LA SALITRERA, CÓDIGO POSTAL 00000, ENTRE CALLE NINGUNO, Y CALLE NINGUNO, POSTERIOR CALLE NINGUNO",48,LA SALITRERA,45,Xichú,SAMUEL RAMIREZ RAMIREZ
11DPR3599S,PEDRO MORENO,2,Vespertino,147,18,No aplica,0,0,0,CERRO BLANCO NUM. SN,28,CERRO BLANCO,33,San Luis de la Paz,SERGIO ANGEL GALINDO RANGEL
11KPR4045J,CURSO COMUNITARIO,1,Matutino,3,88,No aplica,0,0,0,LA GARZA DEL RIO,279,LA GARZA,33,San Luis de la Paz,MARTHA GUADALUPE BREÑA BRIONES
11KJN0626Y,PREESCOLAR COMUNITARIO,1,Matutino,3,88,Incompleta,1,1,0,"CALLEJON SAN PEDRO NÚMERO EXTERIOR: SN, RANCHO O RANCHERIA SAN PEDRO, CÓDIGO POSTAL 37917, ENTRE CALLE NINGUNO, Y CALLE NINGUNO, POSTERIOR CALLE NINGUNO",529,SAN PEDRO,33,San Luis de la Paz,RAMIRO FLORES BOULLOSA
11DJN3604X,EMILIO PORTES GIL,1,Matutino,242,1,No aplica,0,0,0,"CALLE SAN PEDRO NÚMERO EXTERIOR: SN, RANCHO O RANCHERIA SAN PEDRO, CÓDIGO POSTAL 37917, ENTRE CALLE NINGUNO, Y CALLE NINGUNO, POSTERIOR CALLE NINGUNO",529,SAN PEDRO,33,San Luis de la Paz,BLANCA RUTH RIVERA GONZALEZ
11BBE0233N,BIBLIOTECA DE LA ESCUELA SECUNDARIA PILARES DE LA EDUCACION,1,Matutino,888,88,No aplica,0,0,0,RANCHO MANGAS CUATAS,15,MANGAS CUATAS,6,Atarjea,BEATRIZ LOPEZ SANTANA
11EPR0500X,IGNACIO ALLENDE,1,Matutino,520,2,Incompleta,1,1,0,CERRITO COLORADO,105,CERRITO COLORADO,43,Victoria,MARIA LOURDES CAPETILLO MATA
11DPR3368A,FRANCISCO ZARCO,1,Matutino,168,18,Incompleta,1,0,1,"CALLE LA CAÑADA DEL PUEBLITO NÚMERO EXTERIOR: SN, RANCHO O RANCHERIA LA CAÑADA DEL PUEBLITO, CÓDIGO POSTAL 37919, ENTRE CALLE NINGUNO, Y CALLE NINGUNO, POSTERIOR CALLE NINGUNO",548,LA CAÑADA DEL PUEBLITO,33,San Luis de la Paz,CLAUDIA CATALINA VARGAS CAMACHO
11DPR0634N,GENERAL VICENTE GUERRERO,1,Matutino,168,18,Incompleta,1,0,1,"CALLE SANTA MARÍA DE GUADALUPE NÚMERO EXTERIOR: SN, RANCHO O RANCHERIA SANTA MARIA DE GUADALUPE, CÓDIGO POSTAL 37913, ENTRE CALLE NINGUNO, Y CALLE NINGUNO, POSTERIOR CALLE NINGUNO",550,SANTA MARIA DE GUADALUPE,33,San Luis de la Paz,JOSE LUIS LEAL TAMAYO
11DPR0780Y,VENUSTIANO CARRANZA,1,Matutino,170,27,Incompleta,1,1,0,SAN JUAN DE DIOS,20,SAN JUAN DE DIOS,6,Atarjea,MARGARITO MOGICA HERNANDEZ
11KJN0024F,PREESCOLAR COMUNITARIO,1,Matutino,3,88,Incompleta,1,0,1,SAN JUAN DE DIOS,20,SAN JUAN DE DIOS,6,Atarjea,ANTONIO FRANCISCO ZUÑIGA RAMIREZ
11DJN4594N,EMILIANO ZAPATA,1,Matutino,240,1,Incompleta,1,0,1,"CALLE LA SOLEDAD DE ARRIBA NÚMERO EXTERIOR: SN,RANCHO O RANCHERIA LA SOLEDAD DE ARRIBA, CÓDIGO POSTAL 37993, ENTRE CALLE NINGUNO, Y CALLE NINGUNO, POSTERIOR CALLE NINGUNO",99,LA SOLEDAD DE ARRIBA,32,San José Iturbide,LESLIE JAEL GARCIA RAMIREZ
11DPR3739B,PATRIA Y LIBERTAD,1,Matutino,186,21,Incompleta,1,0,0,LOS VEGA DE ABAJO,150,LOS VEGA DE ABAJO,32,San José Iturbide,ARMANDO MENESES RODRIGUEZ
11ETV0351E,TELESECUNDARIA NUM. 359,1,Matutino,535,6,Completa,0,0,0,"CALLE EL CHUPADERO NÚMERO EXTERIOR: SN, RANCHO O RANCHERIA EL CHUPADERO, CÓDIGO POSTAL 37913, ENTRE CALLE NINGUNO, Y CALLE NINGUNO, POSTERIOR CALLE NINGUNO",43,EL CHUPADERO,33,San Luis de la Paz,MARTHA ELENA ARREDONDO RODRIGUEZ
11KPR4162Z,CURSO COMUNITARIO,1,Matutino,3,88,No aplica,0,0,0,"CALLE JOFRE SAN JOSE DEL JOFRE NÚMERO EXTERIOR: SN, RANCHO O RANCHERIA JOFRE (SAN JOSE DE JOFRE), CÓDIGO POSTAL 37916, ENTRE CALLE NINGUNO, Y CALLE NINGUNO, POSTERIOR CALLE NINGUNO",77,JOFRE (SAN JOSE DE JOFRE),33,San Luis de la Paz,MARTHA GUADALUPE BREÑA BRIONES
11BBE0246R,BIBLIOTECA DE LA ESCUELA PRIMARIA DR. ALFONSO CASO,1,Matutino,888,88,No aplica,0,0,0,MISION DE CHICHIMECAS LIBRAMIENTO SUR,110,MISION DE CHICHIMECAS,33,San Luis de la Paz,J. ARTURO LOPEZ RAMIREZ
11DJN3182F,LIC. BENITO JUAREZ,1,Matutino,242,1,Incompleta,1,0,1,"CALLE SAN RAFAEL DE FÁTIMA NÚMERO EXTERIOR: SN, RANCHO O RANCHERIA SAN RAFAEL DE FATIMA, CÓDIGO POSTAL 37913, ENTRE CALLE NINGUNO, Y CALLE NINGUNO, POSTERIOR CALLE NINGUNO",360,SAN RAFAEL DE FATIMA,33,San Luis de la Paz,TANIA ESTEFANIA DURAN DOMINGUEZ
11ETH0216G,VIDEOBACHILLERATO,1,Matutino,,,No aplica,0,0,0,"CALLE GUANAJUATO NÚMERO EXTERIOR: 4 , RANCHO O RANCHERIA PAREDES, CÓDIGO POSTAL 37954, ENTRE CALLE NINGUNO, Y CALLE NINGUNO, POSTERIOR CALLE NINGUNO",22,PAREDES,34,Santa Catarina,J. CRUZ CHAVEZ ALVAREZ
11EJN1013W,SOR JUANA INES DE LA CRUZ,1,Matutino,301,1,No aplica,0,0,0,LA ESPERANZA,27,LA ESPERANZA,43,Victoria,MA. GUADALUPE RAMIREZ MOLINERO
11KJN0481T,PREESCOLAR COMUNITARIO,1,Matutino,3,88,No aplica,0,0,0,CERRITO DE LA ESTANCIA,11,CERRITO DE LA ESTANCIA (CERRITO VERDE),13,Doctor Mora,PENDIENTE
11KJN0361G,PREESCOLAR COMUNITARIO,1,Matutino,3,88,No aplica,0,0,0,EL LINDERO,25,EL LINDERO,13,Doctor Mora,PENDIENTE
11DPR3880R,BICENTENARIO,1,Matutino,180,21,Incompleta,1,0,1,VIBORILLAS,113,VIBORILLAS,32,San José Iturbide,MARIA VERONICA CAMACHO AVILES
11KJN0583Q,PREESCOLAR COMUNITARIO,1,Matutino,3,88,No aplica,0,0,0,EL TOREADOR,127,LA DURA,32,San José Iturbide,PENDIENTE
11DJN4005I,PROMOTOR TECNICO,1,Matutino,242,1,No aplica,0,0,0,(DESCONOCIDO 11DJN4005I) S/N,121,PALMARITO,33,San Luis de la Paz,PENDIENTE
11DPR3644O,FRANCISCO GONZALEZ BOCANEGRA,1,Matutino,57,18,Incompleta,1,1,0,"CALLE TERREROS DE LA CONCEPCIÓN NÚMERO EXTERIOR: SN, RANCHO O RANCHERIA TERREROS DE LA CONCEPCION, CÓDIGO POSTAL 37914, ENTRE CALLE NINGUNO, Y CALLE NINGUNO, POSTERIOR CALLE NINGUNO",348,TERREROS DE LA CONCEPCION,33,San Luis de la Paz,REGINA MOLINA ARREDONDO
11PPR0724K,FRAY LUIS DE LEON,1,Matutino,514,2,No aplica,0,0,0,"CALLE JUÁREZ NÚMERO EXTERIOR: 19 , COLONIA SAN JOSE ITURBIDE CENTRO, CÓDIGO POSTAL 37980, ENTRE CALLE JAVIER MINA, Y CALLE PLUTARCO ELÍAS CALLES, POSTERIOR CALLE IGNACIO ZARAGOZA",1,SAN JOSE ITURBIDE,32,San José Iturbide,MA. GUADALUPE GUDIÑO ARVIZU
11DPR3343S,SUAVE PATRIA,1,Matutino,180,21,Completa,0,0,0,LAS ADJUNTAS,2,LAS ADJUNTAS,32,San José Iturbide,RAQUEL AGUILAR DAMIAN
11DPR3483S,RAMON LOPEZ VELARDE,2,Vespertino,180,21,No aplica,0,0,0,LAS ADJUNTAS,2,LAS ADJUNTAS,32,San José Iturbide,DANIEL TORRES RODRIGUEZ
11DJN0775W,JARDIN DE NIÑOS,1,Matutino,11,7,No aplica,0,0,0,POZO HONDO,148,POZO HONDO (EX-HACIENDA DE POZO HONDO),33,San Luis de la Paz,PENDIENTE
11KJN1356B,PREESCOLAR COMUNITARIO,1,Matutino,3,88,Incompleta,1,0,1,"CALLE SAN ANTÓN DE LOS MARTÍNEZ NÚMERO EXTERIOR: SN, CONGREGACION SAN ANTON DE LOS MARTINEZ, CÓDIGO POSTAL 37918, ENTRE CALLE NINGUNO, Y CALLE NINGUNO, POSTERIOR CALLE NINGUNO",173,SAN ANTON DE LOS MARTINEZ,33,San Luis de la Paz,SAUL SALAZAR BARBOSA
11ETV0648O,TELESECUNDARIA NUM. 697,1,Matutino,535,6,Completa,0,0,0,"CALLE TOREADOR DE EN MEDIO NÚMERO EXTERIOR: SN, RANCHO O RANCHERIA TOREADOR DE EN MEDIO, CÓDIGO POSTAL 37914, ENTRE CALLE NINGUNO, Y CALLE NINGUNO, POSTERIOR CALLE NINGUNO",634,TOREADOR DE EN MEDIO,33,San Luis de la Paz,ANGELICA MARIA GARZA RAMIREZ
11FUA0092T,"UNIDAD DE SERVICIOS DE APOYO A LA EDUCACION REGULAR NUM. 92 ""T' AXHAI""",1,Matutino,8,88,No aplica,0,0,0,"CALLE NIÑOS HÉROES NÚMERO EXTERIOR: SN, PUEBLO TIERRA BLANCA, CÓDIGO POSTAL 37970, ENTRE CALLE 16 DE SEPTIEMBRE, Y CALLE RENOVACIÓN, POSTERIOR CALLE 16 DE SEPTIEMBRE",1,TIERRA BLANCA,40,Tierra Blanca,JUAN MIGUEL GALLEGOS Y GARCIA
11EIC0041Q,IECA PLANTEL TIERRA BLANCA,4,Discontinuo,888,88,No aplica,0,0,0,"AVENIDA CARRETERA SAN JOSÉ ITURBIDE SANTA CATARINA NÚMERO EXTERIOR: SN, RANCHERIA LOS AGUACATES, CÓDIGO POSTAL 37970, ENTRE CALLE CECYTEG, Y CALLE ENTRONQUE A LAS MORAS, POSTERIOR CALLE NINGUNO",1,TIERRA BLANCA,40,Tierra Blanca,OSWALDO MENDEZ BENITEZ
11KPR4037A,CURSO COMUNITARIO,1,Matutino,3,88,No aplica,0,0,0,SAN ANTONIO DE LA CUEVA,78,SAN ANTONIO DE LA CUEVA,43,Victoria,MAURICIO MENDIETA RANGEL
11KPR4138Z,CURSO COMUNITARIO,1,Matutino,3,88,No aplica,0,0,0,"CALLE EL JARALITO NÚMERO EXTERIOR: SN, RANCHO O RANCHERIA EL JARALITO, CÓDIGO POSTAL 37924, ENTRE CALLE NINGUNO, Y CALLE NINGUNO, POSTERIOR CALLE NINGUNO",121,EL JARALITO,43,Victoria,SAUL SALAZAR BARBOSA
11PBH0079K,ESCUELA PREPARATORIA PLAN GUANAJUATO,1,Matutino,,,No aplica,0,0,0,"CARRETERA ESTATAL LIBRE SAN JOSE ITURBIDE - SAN LUIS DE LA PAZ, KM 2+500, NÚMERO EXTERIOR: SN, COLONIA VILLAS DE SAN JOSE, CÓDIGO POSTAL 37983, ENTRE CALLE JAIME I ARAGON, Y CALLE NINGUNO, POSTERIOR CALLE NINGUNO",1,SAN JOSE ITURBIDE,32,San José Iturbide,LETICIA DAVILA SUAREZ
11DJN4248E,CRISTOBAL COLON,1,Matutino,47,7,Completa,0,0,0,JARDINES DE SANTA MONICA S/N,1,SAN JOSE ITURBIDE,32,San José Iturbide,ROCIO GAYTAN LOPEZ
11AIZ0109V,SUPERVISION DE ZONA ESCOLAR NUM. 109 (PRIMARIA),4,Discontinuo,109,21,No aplica,0,0,0,"CALLE JAVIER MINA NÚMERO EXTERIOR: 1 , COLONIA SAN JOSE ITURBIDE CENTRO, CÓDIGO POSTAL 37980, ENTRE CALLE BENITO JUAREZ GARCIA, Y CALLE MARIANO ABASOLO, POSTERIOR CALLE PLUTARCO ELIAS CALLES",1,SAN JOSE ITURBIDE,32,San José Iturbide,ANTONIO ROSAS QUINTANA
11KJN0354X,PREESCOLAR COMUNITARIO,1,Matutino,3,88,No aplica,0,0,0,CARBAJAL,17,CARBAJAL,32,San José Iturbide,GUILLERMINA HERNANDEZ
11EJN1177F,JARDIN DE NIÑOS,1,Matutino,302,1,No aplica,0,0,0,EL CHUPADERO,30,EL CHUPADERO (AGUA ZARCA),32,San José Iturbide,ESTHER RUBIO PEREZ
11DJN3222Q,VENUSTIANO CARRANZA,1,Matutino,97,7,Completa,0,0,0,LINDA VISTA S/N,32,LA ESCONDIDA,32,San José Iturbide,ERIKA YULIANA CORNEJO GONZALEZ
11ETV0645R,TELESECUNDARIA NUM. 679,1,Matutino,525,6,Completa,0,0,0,RANCHO LA ESCONDIDA,32,LA ESCONDIDA,32,San José Iturbide,MARIA CARINA RESENDIZ RUBIO
11DPR1798D,CONSTITUCION DE 1917,1,Matutino,21,21,Completa,0,0,0,"CALLE ESPAÑITA NÚMERO EXTERIOR: SN, RANCHERIA ESPAÑITA, CÓDIGO POSTAL 37987, ENTRE CALLE NINGUNO, Y CALLE SALAMANCA, POSTERIOR CALLE SALAMANCA",33,ESPAÑITA,32,San José Iturbide,RAFAEL HERNANDEZ MUÑOZ
11DPR2829N,LAZARO CARDENAS,1,Matutino,181,18,Completa,0,0,0,RANCHO DERRAMADERO SEGUNDO S/N,394,DERRAMADERO SEGUNDO (INFIERNILLO),33,San Luis de la Paz,SIPRIANO HERNANDEZ ESTRADA
